,Place.3,Place.5,Report
435,27,3800,flc OF AN ltt dsnding request BY apch ctl TO hold alt turn . right after which they took evas action IN respons TO A tcasii RA then subsequ A second action IN respons TO A second tcasii RA . WE ifr dsnding through 4000 FT TO 3000 FT when atc advis US that WE tfc ( 'pop-up ' ) clbing out OF 3200 FT TO level AT 4000 ft. WE clbed back TO 4000 FT level ; told TO make A turn OF 50 deg TO R TO avoid tfc . AS WE enter turn ; WE got AN RA ON tcasii ( 'clb ' ) . I start A clbing turn tcasii command . ( WE never got A TA first . ) when WE show turn rate clb ( 'monitor vert spd ' ) A second RA appear TO overlay obscur first RA . when WE look out windshield ; I observ first RA tfc apch AT about 300 FT below 12 o'clock po . just AS first acft start TO becom obscur BY acft 'S nose ; I spot A second acft AT 12:30 o'clock po appear TO BE somewhat higher . ( acft wa roll out OF A turn horizon wa obscur . ani bank angl would distort actual rel po . ) unabl TO posit ident rel alt closur rate ; I made A split second decis TO turn sharpli back TO L ( IN direct OF origin track ) . I wa also influenc BY fact that first acft just disappear below nose OF acft wa still AN RA target ON tcasii . ( I wa unabl TO dsnd ) . AS second acft disappear below acft ; WE receiv A tcasii messag 'clr OF conflict . ' thi wa clrli A respons TO conflict first acft ; not second acft . even though tcasii display 2 red RA target AT same time ; IT never gave command TO avoid A collis cours second RA target ; OR that WE 'clr OF ( second ) conflict . ' ctlr never advis US OF second acft 'S po OR alt ; BY issu 50 deg turn TO R HE posit acft directli btwn 2 acft that converg vertli US IN middl . I also believ that turn caus tcasii TO becom disori horizli 2 target . 
436,0,4700,nmac btwn A piper pa30 ; twin comanch ; dsnding TO 5000 FT A commut jet make A clbing turn . both acft took evas action apch ctlr issu advisori TO rpting plt OF pa30 . IN dscnt TO 5000 FT ; bdl apch call tfc US AT 11 o'clock po . I spot tfc advis atc that IT wa IN sight . AS I continu dscnt through 5200 FT ; commut jet tfc began A R clbing turn proceed toward US . HE wa ON A collis cours acft I wa requir TO take evas action . I began AN immedi L dsnding turn toward N AT last min jet execut A L turn increas hi rate OF clb . loss OF ifr separ occur btwn both acft . I rpted 'near miss ' TO bdl apch also told them that I wa AT 4700 FT msl due TO MY evas action . ctlr said that HE wa not 'work ' that jet acft . flt continu without incid . upon arr into dest ; orh ; I call bdl atc . ctlr said HE wa not work jet HE wa unawar OF what may have caus acft TO commenc A clbing turn into flt path . 
437,10,11000,A b757 FO rpted A tfc conflict dure dscnt A hold IN vicin OF pvd . bo apch vector US ; acr 1abc ; out OF hold dsnded US TO 11000 ft. anoth acr ; abc ; wa also be vector AT 11000 ft. tcasii alert US OF conflict WE clbed immedi . ctlr queri US ON alt instruct US TO clb back TO 13000 FT . prob aros becaus OF ctlr error . contribut factor includ : similar call sign ; WX hold pattern . conflict wa discov via tcasii ( great tool ) . WE awar OF other acr ; abc ; veri consciou OF ctlr 'S instruct . hold alt read back clrli double-point AT new mode ctl panel alt wa accomplish . 
438,2,700,A hawker 800 cpr flc ha AN nmac A c182 ON A 2 1/2 NM final note that ctlr wa not abl TO maintain separ btwn acft IN ON gnd AT hya ; MA . after dep yng hya . WE arriv AT hya ON A 2 1/2 MI final after boston hand US off TO hya twr WE clr TO land ; when suddenli tcasii went off told US TO clb ; BY A red alert ON screen . WE just start TO clb when WE spot A c182 ( guess ) IT wa just 100 FT away 100 FT below . WE call twr -- there wa NO respons . after lndg turn ON txwi ; twr told US TO taxi TO S ramp . taxi ; WE notic ON txwi ahead OF US that there 2 airplan ON A txwi near activ rwi 1 airplan tail ON rwi twr wa clring anoth commut TO land . ( note : when WE AN nmac ; acft behind US also rpted HE AN nmac same plane there wa NO respons twr . ) twr ctlr wa work gnd twr AT same time . IT wa A veri good vfr day tfc WE ON tcasii wa hvi more 1 ctlr could handl . 
439,5,13000,zbw ctlr incorrectli judg acft perform when IN WX ; not allow suffici later separ btwn a319 dsnding hold A b727 IN A hold pattern 1000 FT below . larg stack OF hold acft boston . acft be step down . acft X AT 17000 FT assign 16000 ft. acft read back 14000 FT . I believ HE rememb hear number fourteen IN hi call sign . acft dsnded TO 14000 FT without event . upon notic thi I vector acft N away conflict acft AT 14000 FT . I then decid TO send acr X into bo AS next arr . acft wa clred direct pvd . moment later I dsnded him TO 11000 ft. due TO steep turn reduc spd acft came into conflict AN acft ( Y ) hold AT 13000 FT . 
440,6,4000,b737 flc take evas action after observ anoth acft come toward them dure clbout which been given BY atc AS A primari target unknown alt readout OR contact apch ctl IN class C airspac . I wa provid ojt train TO A recent xfer ctlr ON apch/dep ctl . traine also approx 18 yr atc experi . acr X b727 depart rwi 29 ; rwi hdg ; clbing TO 3000 ft. acr chked IN 'out OF 2000 FT 3000 ft. ' HE wa assign 8000 FT turn direct manchest ( mht -- dest -- A veri short flt ) approx 240 deg hdg . I been watch A primari target ( NO xponder ) A few MI that wa now 6 NM due W OF pwm ebound . I instruct traine TO 'issu tfc . ' tfc wa issu acr X instruct TO 'stay ON rwi hdg . ' plt respond that they hdg 270 deg ask IF that would BE ok. AT first traine said 270 deg would avoid tfc ; then realiz IT would BE too close turn acr back TO 290 deg ; then rpted tfc IN sight 1/2 MI 'hdg right AT US AT alt ( 4000 FT ) . ' plt question how close tfc came TO them ask what alt WE show ON tfc . WE told him there wa NO xponder ; NO alt . WE track primari target TO A small arpt IN northern main . befor lndg ; plt ask bangor apch A xponder chk ( hi first contact atc sinc depart connecticut ) . plt call US ON phone advis that HE pass over pwm AT 5500 FT ( HE chang hi mind when told that '3 airlin plt will testifi you AT 4000 FT ' ) . HE further said HE wa monitor atc freq 'thought you might BE talk about ME after I saw b727 GO BY . ' whi plt monitor freq never call US IS beyond ME . WE could have avoid AN nmac mayb wors . IF atc svc IS there ; use IT ! IT 'S workload ON atc TO track AN acft give AN altimet constantli BE issu tfc 'type alt unknown . ' I spoke acr plt ON phone told him primari target wa IN AN area where onli alt HE could BE AT ; BE legal ; wa 1500 FT below ; but I traine issu tfc anyway 'becaus you never know . ' MY techniqu ; which I recommend ; IS TO add phraseolog 'no xponder ' when make A call TO A tcasii equip acft . plt like idea becaus they ( like ME ; when I jump seat ) initi look AT tcasii TO better correl tfc rel TO acft . ad 'no xponder ' get everyon look out window instead OF look AT A blank tcasii box . lot OF lesson here : 1 ) atc ; 2 ) fli AT appropri alt ; 3 ) DO n't assum acft are far ; 4 ) alway look out window . 
441,28,6700,flc OF A be1900 stop dscnt IN respons TO A tcasii tfc callout then observ A singl eng piper acft cross underneath them AT alt TO which they assign ON dscnt . WE ON A dscnt 9000 FT TO 6000 FT ; assign hdg 175 deg ; vector rwi 4L visual apch . AT approx 6700 FT ; WE receiv A 'tfc ; tfc ' callout tcasii . doe not give RA 'S . after glanc over AT tcasii ; locat onli ON capt 'S side ; I level acft momentarili until WE A visual ON acft . IT wa A singl eng piper ; appar level accord TO tcasii ; AT 6000 FT ; xing R TO L. after watch acft pass off TO L ; I continu dscnt TO 6000 ft. WE did not queri atc AS TO whi there wa NO advisori given ; onli TO hi initi . WE ON bo apch 118.25 ; just prior TO go TO 126.50 AT approx xa53 IN apr/01 . ctlr wa work other acft ; but did not appear TO BE overwhelmed/overload . 
442,0,2800,A pa28 plt ha AN nmac A murdi cap-10 ( A french import ) 3 MI W OF nashua arpt . IN hi evas dive ; HE may have enter class D airspac OF ash ; NH . depart vfr mht enrt TO bed . wa clred AT OR below 2500 FT vector 320 deg upon depart rwi 35 . I wa hand TO mht apch . ctlr wa sound fluster overwhelm . I believ HE confus ME anoth acft that depart . HE issu them A hdg OF 240 deg ME 270 deg . I acknowledg 270 deg turn TO that hdg . MY dest wa ON A 175 deg hdg ; SO after 5+ MI ON 270 deg ; I xmit 'acft X still ON 270 deg . ' ctlr said 'I given you 240 deg . ' ( I believ IN confus other acft ) . I turn TO 240 deg . IN 2-3 min ; I wa issu 'on cours TO dest . ' thi wa approx 165 deg . thi cours take ME practic over ash ; A class D airspac UP TO 2700 FT . I request OF mht apch ; 'request clb TO 2800 FT TO remain your ctl over ash airspac . ' mht respond ; 'alt AT your discret . ' I continu AT 2800 FT ; pass ash about 2-3 MI TO W AT that point just outsid mht class C airspac . AT that point ; I observ A cap-10 converg 10 o'clock po . I immedi pitch down bank L TO avoid ; possibl enter 100 FT into ash class D airspac . after conflict pass ; I return TO 2800 FT . I AM surpris mht apch never call tfc . I believ thi wa A case OF A somewhat overwhelm ctlr tri TO ctl b737 through c172 tfc . 
443,50,21000,b757 ha TO clb 500 FT ON A tcasii RA when opposit direct tfc overshoot it assign alt BY 500 FT ; 50 MI W OF pvd ; RI . zbw . locat : 50 NM W pvd ; norwich arr . level AT fl210 capt AS PF ; capt gave ME acft TO make arr pa. after give ME acft chking off ; atc made A TA AN acft clbing TO fl200 AT 10 o'clock po . I acquir acft AT 8 NM confirm IT wa clbing ON tcasii . A few second later WE got AN RA TO clb 100 fpm command . I disconnect autoplt autothrottl start A clb TO compli RA . max dev assign alt wa 500 FT . use tcasii ; I confirm that tfc overshot hi alt BY 500 FT . thi wa A good exampl OF make sure you realli are IN ctl OF acft when other guy say 'you have IT . ' 
444,10,8100,zbw ctlr attempt TO vector dsnding at43 when observ A conflict AN enrt ac11 . I dsnded acft # 2 9000 FT TO 7000 FT . when acft # 2 wa about 3 MI acft # 1 ; I notic potenti conflict turn acft # 2 30 deg R. I ctl apch ctl ; through loa ; TO dsnd acft # 2 . acft # 1 wa IN their airspac when they xfer com OF acft # 2 . 
445,6,2000,AN faa be30 AN md88 perform evas action TO avoid each other 10 NM NW OF mht ; NH . ON vector visual apch TO rwi 17 AT mht ; tfc call BY apch . HE appear TO BE turn final . WE clred apch . I dispatch autoplt start AN immedi R turn TO final . I lost sight OF tfc IN turn ; capt kept him IN sight . capt said HE wa hdg toward US took ctl TO avoid A conflict . WE TO dsnd increas bank angl . tfc appar saw US took evas action AS well . I re-took ctl OF acft ON final land unev . supplement info acn 511908 : ON A 10 dme arc AT 2000 FT flt chking con il ; ON W side ; made R turn TO rejoin arc TO GO ebound . IN turn ; observ acr X jet IN A dsnding R turn TO S TO land AT mht . made L turn ( clbing ) TO avoid conflict . 
446,2,1450,sav twr ctlr concern intermitt ; recurr uhf outag . ctlr want freq repair AT date OF outag . radar freq ( sav atct ) xxx.i ha numer outag sinc jul/tue/01 . howev xxx-i main xmitter ha been ot 5 day TO present . freq ha not been work IN A time manner . I have advis mgmnt MY concern . solut : fix prob day IT occur ! callback convers rptr reveal info : ctlr advis that ; ye ; equip wa old when instal IN 1977 ; equip prob are frequent . A new twr ha been auth construct will begin soon . new equip will BE instal ; especi sinc facil wa notifi that lcl telecom compani ha advis that they will NO longer provid repair support old equip . 
447,9,1500,nmac btwn AN sma IN cruis AT 1500 FT msl A cessna 402 ON vector TO downwind leg OF apch dest arpt rwi 24 il . rptr took evas action ; but none taken BY c402 . I depart A small unctl field ( 5b6 ) about 15 MI NE OF dest ; martha 'S vineyard ( mvi ) . WE oper vfr IN margin vmc condit OF 25000 FT broken 3 MI visibl . flt time TO vineyard wa insuffici TO obtain vfr advisori ; SO AN ifr clrnc obtain ON gnd wa onli option radar svc . WE elect TO proce vfr . shortli after dep AT 1500 FT ; I observ A cessna 402c 45 deg off MY R nose AT MY alt ; felt WE ON A collis cours . I enter A 45 deg bank dsnding turn TO R ; avoid other acft BY about 500 FT horizli . other acft did not appear TO deviat . I believ other plt did not see MY acft until WE pass abeam IN opposit direct . c402 appear TO BE ON A vector A downwind leg TO il rwi 24 AT vineyard . WE about TO contact vineyard twr prior TO enter class D airspac when conflict appear . see-and-avoid concept work well enough TO keep 2 airplan apart ; but littl margin ; consid onli one OF US appear TO see other IN time TO deviat . WE would have appear IN other plane 'S L windshield HE wa more difficult ME TO see off MY R side MY L seat po . thi incid clrli illustr limit OF visual separ IN low WX . 
448,11,7000,A pa28 train flt ha AN nmac A piper dure apch TO A non twr arpt AT provo ; near slc ; UT . MY student I do some vor il track practic . AS WE track outbound pvu vor back toward slc WE made A call AT about 8 dme heard NO one IN area . AS WE readi TO turn off radial AN acft wa turn ON TO apch cours ; WE never heard ani radio call acft . provo ; UT ; IS A veri train intens area would greatli benefit A ctl twr . 
449,25,8000,b757 capt complain that ifr separ lost after dep ctlr provid TA OF AN atr72 clred rptr TO clb maintain visual separ other acft who rptr IN sight . IN vmc . dep ctlr provid TA OF AN acft AT 10 o'clock po . ask IF WE acft IN sight . WE respond that WE did . dep ctlr clred US 'maintain visual separ ON that acft ; clb TO 10000 ft. tfc ha you IN sight . ' WE AT 8000 FT msl . I estim that tfc wa initi about 5 NM . I mistakenli thought WE about parallel . I began A clb AT about 1000 fpm ; ON autoplt . I then saw that I wa ON intercept cours tfc . IN order TO obtain greater vert separ ; I increas clb rate TO 2500 fpm . almost immedi I felt that WE not go TO have adequ vert horiz separ . I disconnect autoplt began steep clb TO get vert separ . WE got RA ON tcasii about thi time tell US TO dsnd . WE about 8600 msl tfc wa AT 9000 FT msl . I continu TO clb sinc I wa alreadi IN A steep clb I could obtain vert separ faster IN A clb IF I push acft over TO dsnd . I estim that acr pass below US just AS WE level AT 10000 FT . other acft wa behind US AT thi point . 
450,5,3000,AN apch IS abandon when multipl factor come togeth TO rais confus factor OF all parti involv make IT most prudent cours OF action . thi incid wa worst case OF human factor neg synergi that I have seen IN MY career . accid chain wa 1 link away be complet ON thi flt . flt request A straight-in rwi 11 visual been clred TO rwi 11 TO expedit dscnt TO 3000 ft. rwi 29 wa activ ; but twr often approv opposit direct op . both visual rwi 29 rwi 11 brief apch . straight-in wa request 2 reason : first ; TO make thing easier ON pf/sic who wa behind airplan . second ; TO expedit arr . prob came into play ON A 5 MI final . WE behind profil configur when PF made A turn off final TO A 030 deg hdg ; which wa toward previou dep . AT thi time I ask what HE wa do apch ask alt . nobodi knew what other parti IN thi sit do . PF thought that 030 deg vector given TO compani acft wa US . I thought WE clred apch ( AS did pic OF compani US ) . apch thought WE stop AT 3000 ft. WE final TO break off apch circl TO rwi 29 . dure confus ; thrust revers arm wa skip ON chklist PF turn off gnd spoiler . both OF these item becam obviou dure lndg roll . thi combin PF not extend flt spoiler ( per compani op ) AT touchdown ( I TO reach around throttl quadrant TO deploy spoiler ) made A veri long gnd roll hvi brake . ( thrust revers arm dure gnd roll deploy . ) factor : 1 ) pf/sic : behind acft though veri experienc IN type . 2 ) pnf/pic : apch lndg expect . 3 ) ctlr : ctlr chang dure arr . nonstandard radio phraseolog ( both myself compani ( acft Y ) capt understood 'clred ' rwi 11 'visual . ' what ctlr meant wa 'proce TO rwi 11 expedit TO 3000 ft. ' 4 ) chklist : first 3 item OF befor lndg chklist ( # 1 hyd 'B ' pump ON ; # 2 thrust revers arm ; # 3 annunci recal ) should BE move TO apch chklist . they are too critic TO BE delay TO befor lndg chklist . 5 ) differ acft : crew fli 3 differ type OF jet acft dure ani given WK ; which disrupt flow pattern proc . 
451,1,1100,c172 plt took evas action turn away final apch TO A non twred arpt TO avoid A cessna citat jet ON A straight-in apch . AT bar harbor arpt ; A non twred arpt ; IN vfr condit ; I experienc AN nmac A citat jet ON A straight-in apch . I wa fli A c172 I wa ON A l-hand pattern . after announc TO all tfc ON ctaf that I wa turn base I complet turn TO base . MY pax I heard citat call hi po AS OF 10 MI NE OF arpt ; but WE did not hear word 'citat . ' citat did not announc it po again until OM ; which IS 5 MI end OF rwi . citat did not give it distanc rwi ; just 'citat inbound rwi 22 . ' sinc A citat jet apch AT veri high spd ; IT cover A lot OF distanc btwn rpting point IN veri littl time . sinc I just turn L base ; I knew that A collis wa immin . thi IS becaus I know where OM IS locat . not all vfr plt would have known where OM IS locat . I immedi turn R announc TO all tfc that I wa extend downwind leg . citat pass safe land . 
452,2,1500,A R downwind IS flown after A L IS assign caus A tfc conflict A need A new plan twr ctlr . I wa apch ash arpt N ; receiv advisori class C svc mht . I wa kept higher usual ( 4500 FT versu 2500 FT typic ) probabl due TO use OF A new il apch TO mht rwi 6 . mht apch instruct ME TO dsnd ( 4500 FT TO 1200 FT ash pattern alt ) approx 7 MI N OF ash contact ash twr . I start A dscnt attempt TO contact nashua twr ON 133.2 mhz but wa unabl due TO freq congest . I circl dscnt outsid OF nashua 'S class D airspac 5 MI TO N. I start inbound TO field after establish com ash twr notifi them OF MY po 5 MI TO N ON A '45 deg entri TO R downwind rwi 32 . ' twr later ask MY distanc field ; TO which I respond '2.5 MI N. ' they assign ME TO 'enter L downwind rwi 32 rpt midfield . ' I accept thi clrnc but quickli realiz thi would caus ME TO cross dep end OF rwi 32 ; about 1 MI off dep end ; where I could see one acft apch 1200 FT pattern alt knowledg OF anoth acft depart . I attempt TO rais twr TO request A R downwind but wa unabl due TO freq congest . I continu toward arpt attempt TO rais twr . I wa abl TO talk TO twr upon reach 'midfield OF R downwind . ' MY appear ON R downwind upset twr 'S sequenc plan OF A twin ON R downwind singl eng acft ON L downwind . thi forc A twin TO fli A wide pattern AS IT caught UP TO ME . I chose TO continu TO R downwind attempt TO commun twr after assess option : 1 ) cross extend ctrline TO get TO L downwind thu creat A conflict depart acft AT same alt that I would BE xing . 2 ) circl 2 MI N OF arpt AT pattern alt attempt TO commun ( thi IS probabl best option A reg point OF view ; I assess thi AS not veri safe know there arriv acft behind ME ) . 3 ) clbing circl TO N TO depart area . clbing IN thi area would put ME back into class C airspac OF mht befor be abl TO establish com mht apch . 4 ) continu toward R side OF rwi ; where there wa NO other tfc IN front OF ME sort thing out twr . contribut factor : higher normal apch spd due TO steep dscnt angl apch ctl . be assign AN unexpect L downwind entri that would requir ME TO cross extend ctrline tfc depart along ctrline AT same alt . accept L downwind entri befor realiz that thi would creat A tfc conflict . continu toward R downwind attempt TO commun twr . signific congest ON twr freq delay re-com . 
453,1,1500,nmac btwn A mooney ON final A piper aztec pass 200 FT underneath mooney A low pass . I wa wing man IN A flt OF 2 apch bdr AN overhead apch TO A lndg . lead wa piper aztec ; I wa wing man IN A beach baron . WE IN A L echelon format AT 1000 FT msl . twr A mooney apch A lndg ON rwi 24 R base . WE instruct TO clb TO 1500 FT overhead . I been IN contact lead ON other com radio clb command wa given . I took MY eye off OF lead A second TO look AT MY altimet when I look back AT lead ; HE wa gone sight . AT that point ; I heard mooney ; which wa now ON final ; call out ON freq ; 'hey ; baron just flew under US ! ' I ( IN baron ) state ON freq that I wa over number AT 1500 FT IT must BE aztec that pass under mooney . ' again ; I tri TO contact MY lead ( aztec ) AS did twr ; but HE did not respond . I then acquir him visual depart pattern nwbound . I complet MY overhead break land . A few min later aztec contact twr after A suppos loss OF com land . when WE debrief ON gnd after flt ; lead plt state that HE knew WE do overhead break entri ; but some reason ; HE mistook that mean WE would DO A low apch befor break . also ; sinc HE kept dsnding ; HE TO maneuv TO avoid mooney ; which HE would n't have TO IF HE stay AT 1000 FT OR 1500 FT AS instruct BY atc . HE also state that AT moment ; dsnding under mooney appear TO him AS appropri action TO take AT that point ; somehow dure hi maneuv HE turn down radio volum . I contact twr mgr AS well AS one OF plt IN mooney ; oper OF mooney TO discuss what happen sit wa resolv them . A factor that would OR could have allevi thi sit wa possibl A more thorough brief btwn myself lead plt TO make sure WE both understood pattern entri proc overhead apch . 
454,10,16000,potenti conflict occur when A visual clb IS assign TO A citat jet that then came too close TO A b737-800 IN cruis AT 16000 FT ON freq zbw ; NH . IN level cruis AT 16000 FT wbound ; zbw rpted tfc converg AT 1-2 o'clock po AT 15000 FT swbound AT 10 MI . WE A tcasii target AT that locat . WE pick UP target visual . ctlr ask tfc ( cessna citat ) ; IF HE ha US visual . HE rpted US IN sight . zbw then clred him TO maintain visual separ clb TO fl200 . cessna then commenc hi clb when approx 3 MI AT 1 o'clock po ; tcasii then display A TA aural warn . immedi BY A tcasii RA command A clb . AS WE compli RA BY clbing ; cessna pass below nose AT 300 FT vert separ 1 MI horizli . WE rpted evas action TO zbw return TO assign alt when clr OF conflict . 
455,15,15000,zbw artcc ctlr issu A visual separ clb TO A citat jet below A b737 flt that IS ON A converg cours . condit : vmc good visibl . flt wa clred direct TO manta intxn blm AS dest . WE advis BY zbw OF AN acr Y acft clred TO clb after ident acft own visual separ . pic plt began clb visual separ converg angl ( acr Y acr Y ) . converg angl appear safe A clb 15000 FT TO fl230 . pic began clb TO about 200 FT abov origin alt then receiv tcasi resolut TO stop clb dsnded back TO origin alt 15000 FT ; immedi thu resolv RA acr Y origin 1000 FT clrnc . 1 ) prob : converg angl OF fast move acft . 2 ) bright sunshin ( difficult TO see IN glare ) . 3 ) tcasii alert prob . 4 ) tcasii advis dscnt action . supplement info acn 539823 : error I feel wa caus BY MY inaccur assess OF converg rate spd OF acft Y acft . AS A safeti issu ; I feel that TO have given ME A visual separ restr clb ; ON converg acft wa ill-advis . supplement info acn 539660 : IN cruis ON airway inbound TO bdl AT 16000 FT msl ; zbw advis US OF citat tfc AT 2 o'clock po 10 MI converg AT 15000 ft. WE target ON tcasii final pick UP tfc AT approx 5 MI rpted tfc IN sight TO ctr . ctr then ask citat TO rpt US IN sight . citat rpted US IN sight wa given A clrnc TO maintain visual separ clb TO fl280 . citat acknowledg maintain 15000 FT until approx 2-3 MI AT 1 o'clock po . HE then commenc A clb ; which set off AT tcasii TA which wa immedi BY AN RA command US TO clb . WE commenc AN immedi clb AS cockpit tcasii display ON ma screen show citat close TO within 500 ft. AT thi point A R turn wa also initi tcasii show US close TO 300 FT OR OF vert separ estim 1 MI OF horiz separ . tcasii final US monitor vert spd ; clred OF conflict AT approx 16800 FT msl . callback convers rptr acn 539659 reveal info : rptr said HE wa not comfort clrnc advis capt that HE did n't think IT wa A good idea . HE said they AT mach .72 AT time . FO said capt A brief convers ctr later discuss tcasii event . 
456,48,15000,A mil train flt spill out OF moa after mistak AN acr acft A particip target acft . success ident return TO moa wa accomplish . flt wa A mil train flt ; scenario wa f16 'S perform defens counter-air ( dca ) against f15 'S who simul iraqi mig-25 'S IN A sweep role . airspac wa yanke moa 10000 FT TO fl180 overli laser N ; E W atcaa 'S ; fl180 TO fl310 ( see diagram ) . dure A defens reaction ( notch ) 2 f16 'S ; acft X acft Y dsnded TO 18000 FT time out radar missil ON 1 f15 . they visual acquir A plane 6 NM SW OF them ( lock IT acft Y radar ) that they perceiv TO BE A live f15 . they proceed TO close A visual ident ( vid ) . they close TO 2.1 NM ON acft 'S beam AT co-alt acft Y AT 16000 FT acft X AT 15000 FT ident A commut airlin . acft X call 'knock IT off ' stranger tfc all fighter acknowledg ; termin maneuv return TO their point block . acft X Y went out bottom OF laser E atcaa BY 3000 FT 2000 FT respect when they perceiv they within confin OF yanke moa . A 110 KT wind W contribut TO desir engag zone ( dez ) occur further E then plan . they radar contact tally-ho saab AT 6 NM close TO 2 NM purpos OF visual ident ; SO there wa NO danger OF A midair . flt wa AN upgrad ride acr X who IS learn TO BE A 4-ship flt lead . acft Y wa instructor plt . 
