,Place.3,Place.5,Report
304,2,2200,nmac btwn AN lgt clbing out AN sma sel ON clb out ahead . take off after A small acft ( cessna ; type unknown ; vfr ) WE told TO turn L ON cours ; head 370 deg TO intercept . WE also told TO remain clr OF small acft which WE rpted IN sight . I stop MY turn rwi head OF 330 deg TO 270 deg AT about 290 deg becaus I want TO remain R OF other acft . AS WE continu clbing ; other acft turn R ; OR drift R ; under flt path . WE flew overhead small acft BY 100-300 FT ; accord TO capt ; SO . NO comment OR complaint wa made BY other acft OR twr ; who I felt wa too quick TO releas US ON cours ; AT night ON AN ifr flt path but A 'see avoid ' clrnc ON clbout . 
305,5,4500,flc OF AN mlg stop their clb level off IN respons TO A tcasii RA A subsequ visual sight OF other acft . clbout pvd ( provid ; RI ) arpt ; wbound TO put . AT 4000 FT ; clbing 3000 fpm ; got A tcasii advisori show AN acft 1500 FT abov US 2 1/2 MI IN front OF US apch . began A pwr reduct . AT 4500 FT got A tcasii resolut I immedi level off AT 4500 FT . resolut show acft apch 1000 FT abov US ; 2 MI . got A visual contact acft . HE went almost right over US AT 5500 FT msl . WE level AT 4500 FT msl . ask pvd dep ctl 3 time IF they tfc IN area they said NO target . I believ tcasii save US A veri close call ! atc never other acft ; though HE must have hi xponder ON OR WE would not have A tcasii resolut . 
306,3,11000,AN acr flc receiv 2 differ tcasii RA 'S IN rapid success . first they acquir visual second they clb TO evad . AT cruis 11000 FT approx 3 NM SW OF orw vor ; zbw rpted tfc ; A be1900d ; 12 o'clock ; 7 MI ; swbound . tcasii gave TA . tfc acquir visual . tcasii then went TO RA mode . tfc level AT 10500 ft. NO evas action taken . ctr then advis OF A second target 5 MI IN trail OF be1900 . AT 10000 FT second tcasii TA ; tcasii went TO RA mode clb command . tcasii show second target clbing through 10500 ft. PF did not respond TO initi clb command second clb command . I disengag autoplt initi A clb . PF then resum ctl OF acft . when tcasii initi RA zbw gave US A freq chang TO pvd apch . WE advis zbw WE respond TO AN RA switch TO pvd apch . WE chked IN pvd dsnding TO assign alt OF 11000 FT ( out OF 11500 FT ) after respond TO AN RA . remaind OF flt without incid . I feel main factor 2 target IN close prox TO one anoth . freq chang failur OF PF TO initi respond TO tcasii RA . after WE return TO assign alt PF state that I now caus him TO have TO fill out paperwork about respons TO RA . I feel hi delay wa AN effort TO visual acquir target TO avoid evas maneuv ; IN end avoid paperwork . I feel TO correct prob all plt must respond TO A tcasii RA AS ani other prob/em not consid possibl paperwork that may BE requir . 
307,30,11000,b727 apch ctl given spd reduct hdg chang ; then receiv tcasii RA . ON apch into bo hdg 075 deg given AN immedi spd reduct ; then A turn TO 180 deg tfc . got tcasii 'dsnd ' command but I acquir acft visual . given A turn back TO 270 deg after clr OF conflict but then told TO stop turn AT 360 deg . 
308,8,4000,flc OF AN mlg overshot assign alt dure dep clb result IN atc intervent BY provid A turn TO prevent A conflict . clbing out OF bo depart nbound TO btv ; vt. WE given A clb 3000 FT TO 4000 FT then switch dep freq 133.0 TO 118.25 . MY FO wa fli acft . AS I switch radio ; I notic that HE wa go TO overshoot assign alt . also AT same time ; I notic tfc AT about 11 o'clock AT 5000 FT . when I contact dep ; I misstat that WE clbing TO 5000 FT . correct MY FO TO leveloff AT 4000 FT ; ctlr gave US A 5 deg turn TO R TO avoid A conflict other tfc . MY FO overshot 4000 FT TO 4400 ft. WE recov TO 4000 ft. AT that point ; atc clred US ON cours . MY FO admit TO ME HE wa n't pay attn . I did n't catch IT IN time . also ; I made misstat that WE clbing TO 5000 FT . ctlr state that WE should have been clred TO 4000 ft. NO further discuss wa made btwn US ctlr ; then WE clred TO 12000 FT hand over TO zbw . MY FO state TO ME later that HE wa fatigu did not get A good night 'S sleep night befor . all OF compani run are schedul minimum rest sometim fatigu doe play A factor IN perform . I wa well rest ; but did not catch clbing trend IN time becaus I wa head UP look out window tfc . 
309,40,10000,flc OF AN ltt overshot dscnt alt due TO FO 'S altimet be misset . flt plan AT fl250 TO mht . dure dscnt I wa pnf acquir ati mht . AS per chklist all ati item brief ; AS I read off altimet TO FO ( PF ) I held UP point TO ati number altimet read '29.64 . ' HE look AT number ; repeat IT I watch him dial IT IN ; AS I dial IT into MY 2 altimet ( normal standbi ) . ctlr want A rapid rate OF dscnt . WE oblig 3000 fpm . I caution FO that autoplt ha been known TO disregard alt preselect penetr set alt . not just thi acft ; prob IS fleetwid . HE acknowledg thi wa readi IT . assign alt wa TO BE 11000 ft. AT 13000 FT I caution FO TO expect captur soon fail that TO disengag autoplt effect level off . HE said HE would . 3000 fpm dscnt ; I again state thi AT 12000 ft. AT 11500 FT said ; 'level off IT 'S go TO GO through IT ! ' atc want TO know alt AS WE pass through 11000 FT ; AS I chk hi altimet IT read level AT 11000 FT mine read 10000 FT . I immedi ask A current altimet set select tcasii display ctlr tell US TO clb immedi TO 11000 FT . HE also give tfc A 30 deg turn TO avoid US . I found tfc AT 7-6 MI ; 1-2 MI higher ; later closest pass wa 2 - 2 1/2 sever hundr vert . I chked all 3 altimet . MY 2 correctli set . hi wa incorrectli set TO 30.46 . I chked ati card ; howev write wa clr larg enough not TO confus -- nor could HE explain IT . HE wa veri apologet IS otherwis A veri depend trustworthi crew member . I can onli think HE might have dial IN part OF A freq HE heard dure dscnt . I will chk thi through ON futur flt TO mht . contribut factor : thi airplan IS dark . damn dark ! all OF them are ! I 'M certain that IF more inst/cockpit illumin exist thi would not have occur ; ON ramp without AN eng run IT 'S much wors . I would also vote IN favor OF AN altimet compar warn sy . IF instal IT would alert plt TO potenti mis- set OF their altimet . WE have A hdg compar warn annunci they DO A fine job . hdg compar show A 'C ' IN orang ON ea IF hdg differ BY more 6 deg total . IN futur I 'll have FO call out ati number altimet instead OF accept AN 'ok ' AS confirm that HE ha correctli set altimet . read IT MY side AT night IN turb might not BE ani better but AT least HE will have state set . I will attempt TO read IT each time WE reset them . 
310,27,5500,nmac . pvt GA plt inflt encount flt OF mil jet . rptr believ they extrem close ; but also state she doe n't have familiar mil acft difficult TO judg their distanc . I wa fli pittsfield ; MA ; TO portland ; ME ; IN cessna 172 hawk XP 1 pax . flt plan ; wa file burlington ; depart psf xa00 clbed TO 5500 FT msl ; head direct TO keen vor ; activ flt plan ; wa listen TO bradley apch ; strobe ; nav light ; beacon ON . visibl wa unlimit ; smooth . after reach alt xing mountain out OF berkshir valley I adjust vor dial TO chk radial ; chked dme get readi TO call bradley flt . I look out MY side window TO see 3 mil plane come toward US about 9 o'clock AT AN alt that appear onli slightli lower . I push IN full pwr start A clb ; call bradley ; gave MY po . I hope they would see thi crisi . I did n't ask help thi ; there wa NO time . plane pass below US . first 2 slightli IN front OF US ; third wa directli under US . I can not give ani accuraci TO close IN FT . I would estim 50 plu OR minu vert . I DO n't have ani familiar mil acft ; SO I CA n't use size TO help determin distanc . whatev IT wa ; IT wa way too close . after plane pass ; bradley apch told ME TO contact zbw said I wa too far out bradley . WE continu trip . contribut TO sit wa fact that I wa adjust inst I wa monitor airspac IN front OF ME but not AT MY side ; also ; I should have been tune into zbw not bradley . I wa not IN A mil op area . I definit believ that mil plane ' plt should have been awar OF plane alter their cours mile befor get TO US . I find IT difficult TO believ that great big plane like that are allow TO fli vfr without atc guidanc . 
311,20,3500,g-iii flc do maneuv ha commut acft pass over behind IT dure level flt . second acft ha A tcasii alert . I depart teb ON jun/thu/96 AT approx xx25l IN gulfstream coplt ON AN ifr flt plan enrt TO home base AT oxc . WE ferri AN empti acft subsequ TO complet OF charter flt mdw TO teb . after clring new york class B airspac N OF tappan zee bridg ; I request cancel OF MY ifr flt plan request TO proce vfr TO dest radar advisori . thi accomplish ; I inform ctlr WE clbing TO 7500 FT msl A coupl OF 'steep turn . ' FO IS new ON acft ; I deem IT appropri TO provid g-iii train . AT complet OF 2 steep turn ; I direct A spd brake dscnt TO 3500 FT remaind OF flt TO dest . I SO inform ctlr ; HE mention tfc TO N which I acknowledg AS see . dure level flt AT 3500 FT AN acft pass over behind US ON A southerli hdg . upon arr AT oxc A compani colleagu ; arriv AT home base IN A hawker 700 ; inform ME A turboprop commut flt wa IN discuss new york apch ctl concern hi tcasii provid him AN alert . friday morn AN employe OF oxc fbo inform ME that AN arpt employe learn A rpt wa be file ON acft AN incid that occur ON previou even . 
312,6,1500,biplan plt ON A sightse flt ha nmac atx IN prox OF ata D airspac . rptr cite com prob atx plt not self announc AS they pass near tfc pattern OF 1b2 . later ; atx plt accus plt X OF be IN class D space . inbound TO katama airpark A cessna 402 oper BY atx almost collid ME . I clbed cessna dsnded TO avoid each other . WE miss BY approx 100 FT . afterward I A convers A twr ctlr ident AS MR A plt OF atx acft . plt OF atx acft claim that I wa insid class D airspac . I have flown over 450 sightse flt out OF katama airpark I AM well awar OF class D airspac boundari . I wa clrli oper outsid OF class D airspac . atx acft have A habit OF fli through katama airpark AT tfc pattern alt without ever announc their intent ON unicom . addit I have A wit who saw incid gnd will testifi AS TO MY locat over edgartown IF requir . thi wit IS A polic sergeant who IS also A pvt plt . 
313,15,3000,A commut flc rpt take evas action IN respons TO A tcasii RA that they receiv ON pawl 1 arr . flc also rpt that thi IS not AN uncommon experi becaus they are often fli AT spd close TO 250 kt IN vicin OF unctl vfr tfc ON arr rout into new york 'S class B airspac . ON A flt buf TO jfk ; A tfc conflict occur ON pwl 1 arr . thi happen almost everi time WE come IN ON thi arr IS much wors ON wkend . alt IS too low AT 4000 FT . IT would BE much better TO keep US AT 10000 FT run US farther E over water parallel coast ON down TO jfk . there IS go TO BE A midair IF thi IS n't chang ! callback convers rptr reveal info : when ask about tcasii RA ; rptr ( capt ) state that thi wa not first one ; that HE could give AN exampl OF thi same thing everi singl wkend . rptr take issu fact that tfc ctl seem TO continu TO BE conduct IN same manner ; IN spite OF all conflict relat complaint . ( arr plan keep all commut down low ; AT A high spd ; mix them all sort OF unctl vfr tfc . ) rptr ( PF ) saw thi conflict come . flc 'S acft wa level AT 4000 FT display wa show intrud AT 200-500 FT abov btwn 11:30 12 o'clock ; when RA wa receiv . capt respond ; tcasii command down TO 3000 FT . when ctlr wa inform OF flc 'S evas action ; ctlr simpli acknowledg ; AS IF thi wa noth new . rptr add ; 'and thi wa noth new . ' thi capt feel that without better info ; HE must respond TO AN RA . IN winter month ; IN WX ; ON low visibl day HE ha difficulti gain visual acquisit OF tfc . ctlr call tfc ; OR other acft have acft IN sight ; are not good enough reason not TO respond TO AN RA . supplement info acn 344316 : I DO thi same arr 20 time A month . everi time I receiv AT least 1 TA ; IF not more . arr bring US down TO 4000 FT ; about 70 MI jfk ( dest ) . WE are do 240 kia mix all type OF vfr tfc that IS not talk TO anyon . callback convers rptr acn 344316 reveal info : now ; AN extra 4 OR 5 flt rptr 'S compani are also same pawl 1 arr AS A result OF A rout chang . thi rte add AN addit 40 min ON TO block time ; when fli IN TO jfk ; thi take 1 HR schedul gnd time down TO onli 20 min . rptr 'S flt have been depart late becaus 20 min IS not enough gnd time AT jfk . primari prob ; though ; IS continu tfc conflict . IN 3-4 yr OF fli thi airspac ; rptr ( FO ) ha receiv AT least 15 RA 'S . conflict mostli are A result OF high densiti OF vfr corp tfc oper IN vicin OF white plain light train acft around bridgeport . rptr believ that IF atc kept him UP AT 10000 FT brought him down over hto TO coastlin IN ; that IT would save fuel ; time ; abov all -- live . 
314,12,3000,nmac near same alt ; xing tfc . TA given ; tfc not sight AS IT wa IN wrong po AS given BY apch ctlr . dsnded 9000 FT TO 3000 FT TO BE clred TO 2000 ft. clrnc amend TO remain AT 3000 FT . intent TO land norwood ; MA . tfc rpted AT 3100 FT ; 12 o'clock ; 3 MI . then 3100 FT ; 12 o'clock ; 2 MI . then ; 2 o'clock ; 1 MI . pax plt exercis veri vigor scan . NO contact . then tfc spot 100 FT overhead ON xing cours begin AT 5 o'clock xing TO 10 o'clock po . tfc wa A beech baron . WE did not receiv ani instruct TO deviat . baron wa head N ; WE head NE . given scan subsequ xing path IT doe not seem possibl baron TO have been AT 12 o'clock AT ani time . WE think ctlr mix 6 o'clock po 12 o'clock po . question : whi n't WE given instruct TO deviat ? 
315,2,1400,nmac btwn AN sma sel clbing out OF AN unctl arpt A dc9 apch TO land AT A nearbi larg arpt . sma 'dove ' TO get out OF flt path OF dc9 . ON sep/xx/96 ; AT approx xa25l ; I took off rwi 3 AT 4b9 ; AN unctl arpt . after AN initi clb OF about 600 FT ; I turn 90 deg L then turn further L TO AN approx hdg OF 250 deg . I wa clbing through AN alt OF 1400-1500 FT msl ; about 1.5 MI W OF simsburi arpt ; perpendicular TO midfield ON A hdg approx 40 deg away simsburi 'S tfc pattern downwind hdg ( 210 deg ) . AT that point ; scan horizon ; I saw AN airlin AT MY 3 o'clock po ; dsnding ON A direct collis cours MY acft . I immedi initi forward stick dove MY acft . airlin pass approx 100-150 FT over ME . TO MY knowledg ; NO one wit incid . there ; howev ; wit who observ airlin after IT pass ME ; pass directli over simsburi arpt AT ; what appear TO BE ; pattern OR near pattern alt ( 1200 FT msl -- 1000 FT agl ) ON it way TO A lndg AT bdl . simsburi arpt IS just W OF bdl which ha class C airspac . there IS A notch IN western quadrant OF bdl 'S class C airspac TO allow simsburi 'S tfc TO transit IN out OF arpt bottom OF class C area be 2100 FT msl . both arpt have been IN OP yr I have been fli out OF simsburi over 20 yr . thi wa A holiday weekend WX wa super vfr . there mani pvt acft IN out OF simsburi all day . I DO not understand whi bradley 'S atc would allow AN airlin TO dsnd below class C airspac into A small arpt 'S tfc area ON A vfr day dure A holiday weekend OR AT ani time . 
316,5,1250,A banner tow plt found that HE wa IN same airspac 2 f15 'S over A stadium . rptr claim that area not been made 'steril ' f15 fly-bi . compani chked WX brief ME prior TO flt . advis there wa A notic OF parachut jump IN effect over stadium halftim ( approx xc30 ) . I plan TO depart area prior TO that time . I took off ma07 AT xa30 flew TO stadium . AT approx xa50 ; 2 f15 'S flew over ma07 ON A southerli hdg ; made A L turn flew over stadium ON A northerli hdg AT 1250 FT msl ; pass ME AT about 1000 FT horiz . I wa fli S ON W side OF stadium ; btwn stadium ma07 ; AT 1250 FT msl . I seen f15 'S come knew they would pass close ; but clr . they did not alter cours ; probabl did n't see ME . IF they plan their flt auth TO conduct high spd low level activ ; IT seem there should have been adequ warn dissemin TO lcl arpt ; etc . callback convers rptr reveal info : rptr hi compani believ that area wa not made 'steril ' f15 fly-bi that IT should have been . faa state TO rptr that IT been declar 'steril . ' rptr ha receiv A letter OF investig lcl fsdo . 
317,0,2000,c172 IN tfc pattern wa nmac encount heli . twr wa unabl TO commun due TO A stuck mike ON freq . ON sep/xx/96 ; AT approx xx00 PM MY acft wa involv IN A near collis A heli . I wa pic OF A cessna 172 lndg AT orh . I enter class D airspac N wa instruct BY atc TO enter A R downwind rwi 29 ; told TO rpt mid-field downwind . I rpted mid-field atc instruct ME TO extend downwind tfc . AT thi time A heli pass over top OF MY acft R TO L within 200 ft. AT time OF thi occurr IT should BE note that atc wa have com prob . prob wa believ TO BE A mike which remain open IN anoth acft . 
318,20,1600,c172 wa circl over area when saw anoth c172 nearbi . few min later second c172 overtook rptr requir evas action . A second third pass wa made evas action taken TO avoid . closest encount 100 ft. rptr left area return TO base . airplan I wa fli ( # 1 ) wa circl near lowel ; MA ; chelmsford ; MA . unknown acft ( # 2 ) wa spot approx 8 MI TO W ; fli near A mil radar facil . within min # 2 overtook # 1 ON A collis cours . I took evas action . I circl TO keep AN eye ON # 2 HE came AT ME again ; after avoid him again HE came AT ME again pass right over top OF ME AT NO more 75-100 FT caus ME TO cut pwr dive almost 600 FT . I then left area asap . I DO not know whi thi individu did thi 'stupid ' action ; but WE DO not need peopl IN ski do thi sort OF 'dog fight ' engag . I clbed TO 4500 FT head back TO pvd ; MY home base . 
319,5,4500,apch ctlr took A hdof ON A vfr c152 zbw upon initi contact c152 ask about ani skydiv activ IN hi area . apch ctlr NO rpt ON ani skydiv said there NO notam ON ani IN that area . apch ctlr A primari target onli IN that area ; but appar wa unabl TO track IT . I took A hdof gdm sector OF zbw NE OF gdm vor ON A c152 AT 4500 FT . I began issu advisori ON A primari target opposit direct just S OF gdm vor . plt ask ME IF there wa parachut jump when tfc wa pass close off hi L. I advis him I NO info ON parachut jump IN hi area that tfc wa NO factor . HE told ME HE saw 3 jumper GO BY . I ask him how close HE said about A half A MI . after inquir ctr sector fss ; there NO notam ON jump IN thi area . plt never saw acft that jumper depart . thi area IS ON 2 airway v229 v14 ; accord TO A ctlr AT zbw gdm sector they other rpt OF unannounc jump activ IN area . 
320,2,800,pa28-181 ON train flt wa clred TO land rwi 6 . ON base leg note c172 ON quarter entri TO base leg . advis twr make AN evas 360 deg turn TO L land behind c172 . acft wa suppos TO advis ON final but enter tfc ON modifi base leg . btwn xa00 xa30 ; instruct A pvt plt ON lndg IN A piper pa28-181 ; twr clred US TO land A L downwind leg rwi 6 . after turn base leg begin A dscnt ; I observ AN acft ( c172 ? ) apch ON A converg cours OF about 30 deg R TO base leg AT MY alt AT A distanc OF about 200 yard . I immedi inform twr that I would take evas action execut A 360 deg turn TO L TO re- establish ON base leg . after re-establish ; I ask twr IF converg acft been clred TO land ahead OF US . AS I recal twr advis that converg acft been told TO rpt ON final but instead enter base leg ON converg track land ahead OF US . twr ad A comment TO effect that converg acft wa flown BY one OF better plt . 
321,18,5000,altdev alt excurs occur AS pvt plt IN A pa32 execut AN alt excurs turn ON A new head ; 'vector clb . ' incid produc A potenti conflict opposit direct tfc . ON AN ifr flt plan bdr TO 5b2 ; I wa level AT 5000 FT after pass opposit direct tfc AT 6000 FT . I wa clred A R turn TO 060 deg ; vector clb . after turn TO 060 deg I allow acft TO clb TO 5300 FT prior TO be advis BY ctr that NO new alt wa issu I should return TO 5000 FT . be veri familiar thi rte know that A clb IS usual given AT thi point may have contribut TO MY prematur clb TO 5300 FT . I would suggest that A better clrnc would have been 'R turn 060 deg ; ' OR 'R turn 060 deg maintain 5000 ft. ' leav word clb out OF clrnc would probabl have prevent ME make mistak . 
322,15,6000,A be99 ifr AT 7000 FT hold A commut be02 TO depart rut arpt befor start apch claim that be02 came within 500 FT one half MI him . be02 plt state that HE wa AT 6000 FT . supposedli ; be02 depart after hi void time laps . be vector BY zbw ; I A veri close near miss A commut . zbw wa unabl TO clr ME lda rwi 19 apch AT rut due TO depart tfc . atc vector ME around ; keep ME N OF ira ndb AT 7000 FT . stay IN radar contact ; be vector around ; I made radio contact acft ON gnd ( AT rut ) ; which wa prepar tkof . plt wa not veri respons TO ME ; although I did tell him I wa IN imc condit ; ON AN ifr flt plan zbw ; inbound TO rut . veri shortli after thi convers other acft ctr clred ME direct TO ira ; clred lda rwi 19 AT rut . ctr also said that void time depart acft elaps . AT that moment I saw be02 just 500 FT lower 1/2 MI across ME . I wa AT 7000 FT msl ; told ctr that I saw be02 . be02 plt told ctr that HE not seen ME . be02 wa advis ctr HE wa AT 6000 FT request 7000 FT ; also request hi ifr clrnc . bad judgement TO depart rut fli into imc ; wa made BY plt who lack experi . possibl AN rca6 should BE place AT rut ; SO plt can com ctr directli ; instead OF talk btv fss . 
323,15,8000,A commut sf34 acft wa issu A dscnt BY mistak TO 8000 FT instead OF 9000 FT ; A b737 clbing TO 8000 ft. A ctlr reliev po notic sf34 AT 8300 FT clbed acft TO 9000 FT ; but not befor ltss occur . commut acft ( acr X ) wa ON v16 nebound ; dsnding TO 8000 FT . b737 ( acr Y ) ; wa nwbound ; clbing TO 8000 ft. AS reliev ctlr ; I wa told that acr X wa dsnding TO 9000 FT ref acr Y clbing TO 8000 ft. 15 second after I sat down ; I realiz that acr X wa AT 8300 FT ; SO I clbed him TO 9000 FT exchang tfc . each acft saw each other . 
324,10,5400,nmac btwn AN lgt dsnding A piper seneca ; pa34 xing through lgt 'S flt path . 10 NM NE OF bdr vor ON v475 dsnding out OF 6000 FT TO 5000 FT AT 5400 FT ; WE avoid hit what wa believ TO BE A seneca dsnding 10 o'clock po ; head toward 4 o'clock po . NO time TO respond WE simultan grab yoke ; pull autoplt TO disconnect . thi acft NO light ON whatsoev NO xponder . WE advis new york apch OF near miss HE onli respond that HE did not see anyth ; but A few second later HE did advis US that HE wa show A primari target AT 4 o'clock po . thi area bdr arpt surround airspac IS constantli danger . IT alway conflict lga 'S arr . apch dsnd all tfc TO low alt AT least onc A month AN acft pass over thi area IS tell new york apch that they 're respond TO A RA . there are too mani small acft over thi airspac without xponder ; unfortun thi IS just A few MI N OF 30 MI xponder ; requir . IT should BE extend N . 
325,5,1400,WX avoid maneuv place m20 plt IN prox OF arr tfc acft . potenti conflict . depart teb ON vfr trip TO ack . WX brief indic cig 'S 2000 FT TO 5000 FT along rte possibl ice IN cloud . visibl wa gener 5 MI OR better . NO indic OF snowshow AT rpting station along rte . I decid vfr AT 1500 FT wa better ifr IN cloud where ice might BE encount wa rpted . flt NY tracon until bdr class D. contact bdr twr . rpted 'clr E ' wa advis TO contact hvn twr -- still IN good vmc . about 7 MI W OF hvn encount hvi snowshow . contact hvn twr wa told 'field IS ifr ; 800 FT ovcst . ' AT thi time I execut A 180 deg turn toward S wa advis BY hvn twr ; 'apch ha advis OF A conflict AN acft ON rwi 2 apch cours . ' I elect TO turn L approx 260 deg A hdg OF 170 deg back through N TO 270 deg . thi prolong MY time IN imc ; but turn ME away rwi 02 apch cours . AS soon AS I establish 270 deg hdg vmc condit resum . prob aros becaus I good visibl initi IN snowshow assum they A lcl phenomena . gener poor visibl over long island sound AT night mask true size OF snowshow activ . I feel MY correct action wa swift ; although I did not ident imc condit IN A time enough manner . good WX AT bdr led ME TO conclud that hvn wa okay ; vmc . thi wa also support BY earlier WX brief . I AM realli angri myself not listen TO hvn ati prior TO contact twr . thi wa AN inexcus ; lazi ; unnecessari oversight . never again . although thi event IS A vmc into imc incid ; IT ha made ME re-evalu MY gener oper guidelin vfr versu ifr . I continu flt success IN good vfr AT 9500 ft. AS A singl eng ; NO ice airplan driver ; I have often opt 'scuddi ' flt over file ifr . IN thi case ; thi wa A truli poor choic . teb ack most OF rte improv vfr . IT wa certainli possibl TO file ifr clb vmc TO top ani snowshow activ IN area . but AS soon AS WX brief rpted 'ice ' I discount ifr AS A possibl choic . furthermor ; I rememb think over bdr that I could see 'star abov ' IN most direct . I DO n't know whi I continu into snowshow activ when IT would have been quit easi TO clb vfr TO see how high snow produc cloud . AT that point ; A go-no-go decis could have been made without pressur . classic human factor AT work here . I wa late A plan dinner MY 'get-there- ' made IT too easi TO convinc myself that I could see edg OF snowshow . thi also distract ME ; caus ME TO 'forget ' TO listen TO hvn ati . night fatigu insidi contributor . 
