,Place.3,Place.5,Report
1,9,2500,helicopt encount sma acft IN see avoid situat . took evas action . f/o fli acft left seat . blue white sma appear behind left door post . sma wa level apch heli 10 o'clock po . PF spot sma ; alert other plt make right evas turn . capt initi immedi de ; f/o continu TO fli acft . sma pass directli over heli vert sep OF 150 ' . heli crewmemb did not observ ani attitud ; hdg OR alt chang IN sma . flt continu TO jfk w/o incid . 
2,22,4500,close prox ga-sma ga-smt ON v106 . level AT 4500 ' ; hdg 246 deg ON victor 106 directli into sun ; bradley apch ctl instruct ME TO 'turn right hdg 330 deg vector around tfc . ' turn right A hdg OF 246 deg TO hdg 330 deg ; well into right hand turn ; converg tfc appear ; take UP major OF windshield OF sma I wa fli ; approx 20-30 yd away . I took evas action BY execut A quick clbing right turn . IT appear smt took NO evas action IN thi incid . I believ situat occur becaus OF limit vi due TO sun becaus OF vector bradley apch issu ME . altimet set I wa given wa 30-59 ( BY bradley ) ; smt wa said TO BE vfr . I wa show A lndg light AT time I wa transpond equip mode C. callback convers rptr reveal : rptr file A near miss rpt faa ha been advis they are contact other plt . rptr ha also sent A letter request result OF their investig . rptr said HE made A standard rate turn TO hdg assign BY bdl AS soon AS IT wa given but did not tri TO talk TO bdl about whi they gave vector . 
3,2,800,close prox 2 ga-sma acft IN traffic pattern AT plm . I wa involv IN A nmac ON final apch TO rwi 24 AT pym . I wa conduct A plt chk flt A pvt plt wish TO have rental privileg AT fbo/flt school where I AM A part time cfi . I can onli assum I wa involv IN A midair near miss becaus I never other acft IN sight . but ; I assum IT did happen base ON statement OF plt OF other acft . taxi TO activ rwi I attempt TO confirm plymouth unicom that acft radio wa oper properli . I never receiv A respons them TO MY request A radio chk . I assum acft radio wa not transmit but decid TO continu flt sinc use OF A radio IS not requir AT unctl arpt . TO help plt see US better ; I turn ON acft 'S nav ; strobe lndg light left them ON throughout flt . also ; I did broadcast MY po anyway oper IN tfc pattern . dure third lndg WE turn ; after be establish ON A base leg I heard plt OF AN sma Y broadcast HE wa also ON base . I began TO look him . onc MY acft wa ON final ; A few sec later ; I heard him broadcast that HE wa go around . AT thi point I still did not see sma Y proceed lndg . onc ON ramp after HE shut down ; HE came over TO ME explain how close WE come . HE also told ME that I shot out under him . sinc WE both fli low wing acft ; I can onli come UP one explan . IF I wa under behind him ; I would have TO see him . MY explan IS that WE alreadi ON final proceed toward rwi AT about 70 kt ; final apch spd OF sma Y IS 63 kt . sma X AN apch spd recommend BY acft mftr IS 75 kt ; wa turn base TO final . spd toward rwi would certainli seem like WE overtook acft ; but AT that time WE would have been travel IN differ direct . fortun NO accid occur . sinc MY acft wa under sma Y ON final WE right OF way . plt OF sma Y rpted A nmac rpt NE fsdo offic . sinc I wa IN right seat ; base TO final turn would have posit roof OF sma X TO block ani tfc abov US . apch spd approx 70 kt OR lower ; sinc I insist ON thi student wa pay particular attn TO how pvt plt I wa chking wa handl acft . all 3 time WE flew tfc pattern proper alt ; turn ; etc ; made 
4,15,3500,close prox GA sma parachutist IN restrict area that wa advertis not activ . ON cross-countri vfr orang ; MA TO hanscom ( bed ) ; near collis parachutist AT OR near restr area r-4102 A & B AT FT deven ; MA . I A full preflt brief bridgeport fss notam approx 1 HR prior TO dep . NO notam indic that r-4102 A & B was/wer activ . normal activ day IS sat onli . mani plt think that there can BE NO activ IN AN inact restr area . legend ON aeronaut chart should remind plt that some civilian OR mil op are still possibl even IN AN inact restr area . NO accid result IN thi incid ; but vert dsnding parachut are veri difficult TO sight avoid . I wa abl TO make A shallow bank turn TO avoid parachut . 
5,2,1800,standard separaton nmac between commut sma acft . oper error . upon reach madison vor WE request clrnc direct TO pvd advis BY bo center that quonset would issu that clrnc . WE contact quonset tracon ON 133.85 ; request grant 'direct pvd . ' AS po wa somewhat S W OF arpt ; lndg rwi 23l/23r ; WE given A vector ON A 050 deg hdg told TO dsnd TO 5000 ' ; AT which time all lndg light illumin . WE then clred TO 2500 ' . upon reach situat reservoir ; approx 7 MI W OF arpt ; WE turn over TO anoth quonset ctlr ON 124.5 . WE advis ctlr that WE arpt IN sight . HE told US WE clred visual TO rwi 23l TO stay him . AT thi time ; WE advis that there wa tfc 2 MI N OF arpt AT 1800 ' . NO further info about thi acft wa given . WE proceed inbnd TO arpt ON approx A 070 deg hdg . AT thi point WE approx 1-2 NM W OF arpt unabl TO contact ctlr who wa talk TO anoth acft . AT A point approx 2 MI N OF arpt ; ON approx A 075 deg hdg ; WE saw sma Y ; appar A tfc rptr . AT time I saw acft Y HE wa AT 12 o'clock po 1 MI ; AT same alt ; opp direct . WE alter cours TO left pass BY acft . AS soon AS thi occur ; quonset advis US TO contact pvd twr lndg clrnc . NO mention about acft Y . when WE came UP ON twr freq ; 120.70 ; plt OF Y wa talk TO twr about US . WE call twr ; advis that WE just been turn over TO him BY quonset . WE clred TO land . after lndg ; I call both pvd twr quonset tracon . twr personnel seem rather put out that quonset not turn flt over TO twr earlier . AT quonset tracon I spoke TO watch supvr wa advis that A trnee been ON po been reliev shortli after incid . 
6,2,5000,sma conduct acrobat train ha nmac smt . thi wa AN aerobat trning lesson . acft wa just recov A wing over ( nose approx 10 deg below horizon rise ; bank approx 30 deg roll out ) . AT thi time MY student I spot smt AT 12 o'clock ; go right TO left . HE wa begin A right bank . WE continu right bank pass well clr . when WE arriv AT dispatch I wa inform that smt call rpted A near miss . HE also complain that WE practic aerobat IN A busi area . WE clr OF all ata 'S ; tca 'S ; ctl zone more 4 NM nearest victor arwi . I did not believ thi wa A near miss . NO unusu action wa requir TO avoid smt . 
7,8,4000,nmac between acr mlg glider . enrt bo direct mht ; radar vector TO visual apch TO rwi 35 mht ; normal flt lndg . enrt TO mco WE receiv AN acar messag op TO call mht twr upon arr IN mco . capt did SO wa told that A sailplan IN tow rpted A near miss US approx 8 MI SE OF mht . HE wa also told that tow plane saw rpted noth . hi ( sailplan plt ) rpt ; WE estim be 4000 ' . final cruis alt bo wa 7000 ' msl . WE saw noth took NO evas action . I would like TO mention that capt did rpt A sailplan that HE spot well below US -- IN fact ; below 3800 ' broken layer WE abov AT A point insid mht ctl zone WE ON A vector visual apch TO rwi 35 mht . HE did not see A towplan though ; onli sailplan . callback convers rptr reveal : flt crew ha heard noth further incid . glider plt that file rpt said HE felt jet wash SO that could have been some distanc after jet pass . rptr said glider plt may have reconsid file nmac AS wa IN area where did not belong . thi rpt wa file IN case WE get more same area . 
8,10,10700,lgt ON ifr arr rout wa given traffic ON unk-smt B who later took evas action miss lgt . I wa fli acft AT 11000 ' msl level flt airspd 250 kt . capt wa work radio . atc advis ; 'tfc 10-11 o'clock ; 6 MI ; 10000 ' swbound ; unverifi . ' crew thought IT strang that tfc wa not AT A vfr alt . WE all look tfc . atc : 'tfc now ( broken xmission ) MI 10500 ' turn wbound . ' s/o OR jumpseat rider : 'there ; 11 o'clock ; just abov horizon . ' capt state ; 'watch him ; HE 'S clbing . ' acft appear TO BE A light twin eng acft . atc : '10700 . ' acft wa wing level off left side OF acft ; AT what look like same alt . I wa about TO take evas action when I saw light twin make A veri steep right turn . capt state ; 'he 'S go TO miss US ! ' acft pass off left side OF acft . capt state TO bo center ; 'damn ; that wa too close . ' atc respond that 'he hope target US visual . ' I feel bo center felt ; ON first callout ; that there would not BE A conflict tfc . atc realiz prob when target turn wbound began TO clb . I DO n't think atc time TO vector US away tfc that HE did proper thing BY keep US inform OF target 'S alt hdg . supplement info acn 85767 : atc : '10700 ' ; ' target not ident BY head ON profil AS A light twin ; wing level AT left side OF MY windshield AT alt . I reach yoke TO break right ; ( f/o state later HE wa about TO also ) but saw twin make A veri steep right bank ; I state ; 'he 'S go TO miss US ! ' twin pass MY left slide window show US hi undersid . AS I smt Y look aft ; HE appear TO level hi wing appear TO pass behind US . I state TO atc ; 'damn ; that wa too close ; ' atc answer TO effect that HE hope target US visual . I believ that atc felt ; same AS I did ; that ON first callout there would BE NO conflict ; ( IE ; smt Y hdg SW would put him far TO right when path converg ) . HE realiz prob when HE saw target turn W clb ; but did not have time TO vector US . I feel that hi action IN keep US inform wa about all HE could DO . 
9,3,4000,lgt smt have near midair collis . WE dsnded down TO 4000 ' msl . dscnt chklist complet ; altimet set TO bdl set . capt 'S coplt 'S altimet within +/-25 ' . level AT 4000 ' approx 3 MI S OF arpt ; apch call tfc 11:30-12 o'clock po ; 3500 ' 2 MI . WE respond ; 'no joy . ' 30 sec later WE ; coplt myself ; spot tfc 12 o'clock AT alt 1000 ' pass W TO E. WE hardbank left ; HE did same ; pass off right wing tip . apch ask acft ; A twin eng smt ; what hi alt wa . NO answer . HE ask again ; NO answer . WE switch over TO twr ctl heard noth more . flt crew first leg togeth NO prob . WX wa A low ly haze ; top about 2000 ' . whi then did n't WE see tfc ? three set OF eye look him . better yet ; whi did n't HE see US ? all light ON ON A fairli larg acft ( lgt ) ? correct action TO left becaus OF hi direct OF flt . IF WE turn right IT would have been disastr . IT seem A tca would have definit help . I think atc IS cut acft too close TO accommod too mani acft AT one time -- especi GA transport . they must rememb who pay TO use arpt give prioriti TO transport . let 'S recommend TO keep f/e 'S po IF even simpl fact OF 3 set OF eye are better 2 . IN thi case ; IT probabl would have end IN tragedi w/o one . 
10,15,5000,close prox acr mlg unk ON il apch TO bdl . apch said TO slow TO 210k . WE ask A lower alt ; apch said after slow ; descend TO 5000 ' . apch later said HE would 'box US IN north side ' . I saw anoth acft come left ; ( who wa ON loc AT 5000 ) I ask apch sever time about thi other acft ; but HE wa too busi TO respond . onc HE did respond HE abruptli said maintain 6000'.we AT 5600 ' descend climb back TO 6000 ' . MY guess IS that most acft descend TO 5000 when give US that clrnc ctlr did not expect TO have TO send US through loc . 
11,7,1500,acr-mlg be vector visual apch wa descend below mva into conflict acr-lgt ON il apch . WX wa rpted vfr 20 scatter ; 250 scatter . one acft vector il 4R ; other vector visual apch TO 4L . cloud layer move IN . sever OF cloud layer wa not made clear . atc wa mistaken AS TO vma IN area dsnded acft ON visual apch TO what HE thought wa mva IN order TO get below cloud . sep btwn acft ON visual apch acft ON il apch wa subsequ lost . thi info came TO light after ntap . IN ctlr 'S judgement ; sep wa not lost . sep wa also lost btwn acft ON visual apch ON terrain . solut TO prob IS TO make ctlr more awar OF WX how quickli sever IT can move IN . addit ; acft ON visual apch never made ani comment about cloud ; which led ctlr TO believ cloud just A scatter layer not A factor TO A good ; safe visual apch . plt wa awar that HE wa ON vector visual apch . also ; trning should BE given TO ctlr TO refresh memori about mva 'S ; AS sometim WE tend TO DO thing BY rote . callback convers rptr reveal : rptr ctlr wa vector AN acr mlg A visual apch TO rwi 4L ; think mva wa 1500 ' A scatter cloud layer AT 2000 ' ; dsnded mlg TO 1500 ' IN AN area OF 1800 mva . that wa error # 1 . then ; AS mlg apch final apch cours rwi 4L acr lgt ON il rwi 4R ; still not IN cloud ; radar sep wa lost between two when mlg enter more cloud lost sight OF lgt . thi system error occur mainli becaus ctlr continu TO tri TO conduct visual apch after WX deterior TO point that visual apch could not work . 
12,15,3000,ltt sma have nmac . apch clred US TO descend 5000 ' TO 3000 ' ; descend through 4000 ' descent checklist wa initi . non-fli plt ( f/o ) challeng ; I wa respond ; TO checklist item . dure thi phase attn wa divert TO cockpit task ; thu outsid scan wa interrupt . within 15 second OF level AT 3000 ' AN sma appear 3:30 posit AT approx same alt . I initi evas action ( descent turn TO right ) WE pass within A few hundr feet OF sma . I believ primari caus OF near-miss wa reduc vigil outsid cockpit deal distr OF requir checklist . apch ctlr never call tfc out TO US - probabl becaus HE himself wa veri busi ifr tfc provid radar advisori TO numer vfr acft . I feel safer fli ON A low ifr day ; when all sma 'S are ON gnd . thi incid reinforc MY resolv TO keep AN eye outsid during/whil 'check ' are IN progress insid cockpit . 
13,30,12500,close prox acr-lgt ga-smt ON airway south OF pvd . quonset apch ctl advis vfr tfc 12500 ' ; 12 o'clock . MY acft wa dsnding through 12500 ' AT moment OF advisori . f/o ( fli ) immedi increas rate OF dscnt . tfc wa sight 12 o'clock ; approx 1/4 MI AS MY acft pass through 12300 ' . tfc pass approx 200 ' overhead ON reciproc hdg . tfc wa not IN radio contact apch ctl . believ TO have been AN smt . earlier advisori would have been help . vi wa good IN some haze . head ON profil made sight difficult . lack OF com btwn vfr tfc atc major caus . 
14,12,16000,acr-mlg cpr-smt ON converg cours AT same alt . standard separ . sever acft A factor . all acft TO fli IN same gener direct . acft involv : # 1 clbing TO flt level ; depart provid ; proceed via ctr wbound . # 2 : out OF hya proceed TO ewr via baf vortac AT 16000 ' . other acft jet dsnding out OF flt level TO 17000 ' ; lndg swf ; level AT 17000 ' AT time OF incid . sever other acft wbound over baf out OF logan arpt lndg lga/hpn ewr . awar BY ctlr OF pend loss OF sep ( acft converg ON 300 deg 280 deg hdg ) . unabl TO clb TO abov 16000 ' IN time due TO 17000 ' tfc . turn both acft but not befor loss OF lat : 4.3 NM . NO evas action requir . human error due TO misjudg parallel hdg . better use OF flow ctl ON tfc proceed over baf/ctr vortac dure certain time OF day . other caus : ctlr assign manual ctl po wa not work IN A team environ . coord wa not UP TO par . insur capabl OF all ctlr assign busi sector . stress team effort . 
15,20,6400,mlg ha nmac anoth acft ; AN smt OR larger ; outsid bo tca . flt portland ; ME ; wa approx 20 MI out OF boston ; dsnding through about 6400 ' AT 250 kt assign TO intercept il rwi 27 loc when I spot AN acft AT about 10:30 po ON A collis cours . acft AN sma type OF profil ; but look bigger I judg IT TO BE AT same alt WE AT most 1-2 MI away . there wa NO time TO turn . I close throttl immedi put plane into A dive AS rapidli AS possibl . IT appear that other acft start TO clb it right wing went UP . it direct OF flt wa toward nne ; WE come E either ON rwi 27 loc OR about TO intercept IT . whole incid happen SO fast ( about 5-15 sec ) that f/o did n't even see other acft until IT wa pass directli overhead . HE estim it clrnc TO BE 100-200 ' . about 20 sec later ; I regain enough composur TO ask apch ctl whi they not call out that tfc . apch ctl repli that other acft wa 900 ' abov US that she n't seen IT . 'it 'S outsid tca ; ' she ad . her tone OF voic clearli impli ; 'big deal ! what 'S your prob ? ' OF cours BY then other acft would BE higher US ; HE wa obvious still clbing AT max rate WE dsnding AS sharpli AS WE could w/o turn airplan upsid down . IT IS difficult TO say whi I not spot other acft sooner . IT all happen such startl spd that I can not even say whether IT first appear IN front OR side window . IT might have been behind metal frame separ 2 . WE continu IN TO land AT bo w/o further incid . there wa NO injuri TO pax OR crew ; but f/a 'S all state that they notic sharp pitchov that IF they n't been strap IN their seat ; they would have come off floor . I AM sure they would have ; but A midair collis wa avoid . ctlr IN thi instanc wa busi AS she point out ; WE outsid tca . IT IS comfort TO know that she wa IN NO way respons point out vfr tfc . AS A p. . ; I would like TO note that clbing OR dsnding ; A plt 'S judgement OF vert sep IS AS least impair may BE complet erron . IT would not BE accur until you actual hit . horizon displac ON windshield due TO dscnt somewhat obscur due TO A slight haze ; ani estim OF initi vert sep could have taken A few sec ; AT that closur rate ; you DO not have sever sec TO initi action . I recal AN accid some 30 yr ago where AN acft depart NY sbnd AT night becam invert IN it attempt TO miss apch lndg light OF anoth plane that wa actual 1000 OR more FT vert separ him . acft crash IN ocean just S OF nyc loss OF all soul . 
16,0,100,nmac AT uncontrol arpt involv il apch opposit direct rwi IN use . IN btwn student I wa watch lcl tfc AT oxc . AS IS customari ; even though rwi 18 wa activ ; peopl practic il 36 apch . I observ AN sma X take off rwi 18 . AT same time AN sma Y il 36 ON A 1/4 MI final . sma Y appear TO BE continu lndg . AT approx 100 ' agl both acft appear TO notic each other took evas action . IT appear that permit converg apch TO minimum AT unctl field will eventu lead TO more midair ( EG ; san lui obispo sever yr ago ) . AS AN instr I feel more vulner TO thi situat becaus OF MY continu use OF unctl field . plt educ enforc should stress safeti AT unctl field . callback convers rptr reveal : rptr express great concern about freq OF thi nmac situat . HE IS A flt instr feel student IN trning have enough TO consid w/o thi danger situat OF head ON tfc . feel aim OR far 'S should BE specif about limit practic apch AT unctl arpt . 
17,15,16500,nmac between acr-mlg unk-ltt . WE ON AN ifr flt plan under artcc ctl . dsnding through approx 17000 ' 11000 ; artcc call out tfc AT 1 o'clock ; 1 MI AT 16500 ' . AS artcc end hi xmission ; f/o I saw A bright yellow acft AT 2 o'clock po ; AT alt ; which wa now about 16500 ' ; AT A rang OF about 300 ' . WE believ thi yellow acft wa AN ltt . yellow acft wa difficult TO identifi becaus : HE wa SO close that WE saw him one second OR HE wa IN A hard left turn WE could onli see bottom OF hi acft . WE insuffici warn insuffici time after sight other acft TO take evas action . cours wa 055 deg yellow acft wa hdg approx 330 deg . 
18,0,600,nmac . I wa fli AN ltt into lebanon ; NH ; 8/fri/88 . I wa IN tfc pattern -- left tfc rwi 25 . I rpted left downwind . wa told BY twr TO rpt A left base . I rpted A left base wa told BY twr that I wa IN sight that I wa clred TO land ON rwi 25 . immedi that radio xmission ; twr receiv A radio call AN sma who rpted over leb vor . twr told sma that HE wa # 2 TO AN ltt IN A left base ( MY acft ) . I turn final proceed TO land . I never saw sma . evid sma did not see ME until HE came TO within A rpted 100-200 ' . vi wa 5 MI IN haze sun may have obscur vi somewhat . perhap sma should have rpted TO twr HE did not have ME IN sight OR twr should have ask sma IF HE ME IN sight . I AM file thi rpt upon hear that sma IS file A near miss rpt I want TO give MY version OF event that took place . 
19,5,12000,standard separ when smt took descent clrnc meant anoth acft came into conflict AN ltt ; opposit direct ON same airway . smt X took clrnc meant mlt Y dsnded through ltt Z below him . callback convers rptr reveal : smt X mlt Y both NE bound v268 ; smt X lndg ewb mlt Y lndg nzw . ltt Z wa opposit direct AT 12000 ' . both smt X mlt Y AT 13000 ' . rptr gave dscnt clrnc TO mlt Y both mlt Y smt X acknowledg clrnc . rptr did not hear smt X acknowledg . later ; dure investig ; listen TO tape ; IT wa found that mlt Y 'S acknowledg wa onli A hiss readback smt X IS loud clear . rptr admit that HE did not hear wrong acft answer dscnt clrnc . BY time HE saw mode C OF smt X show dscnt ; IT wa too late TO correct mistak avoid A loss OF sep . 
20,54,5500,acr-mlg flt crew sight took action TO avoid AN acr-lgt converg AT same alt . ON gardner 2 arr TO bo fli 111 deg R level AT 6000 ' notic light OF AN acft fli approx SW direct . howev due TO strato type cloud ; could not determin alt although could tell there wa A converg OF 2 acft . about time TO ask bo apch OF other acft apch advis lgt Y TO turn TO 180 deg hdg mlg X ( US ) TO turn TO 180 deg hdg dsnd immedi TO 5000 ' . believ other acft wa lgt ; WE AN mlg model . definit ctlr error ; howev HE actual aggrav situat BY turn both acft TO same hdg which put wing UP into other acft . WE kept other acft IN sight ; howev until suffici distanc separ US . 
21,12,5400,wdb given traffic inform ON unknown sma traffic saw acft pass IN close prox A few second later . NO evas action BY either acft . wdb X wa be given radar vector A visual apch into bangor ; ME . dsnding through about 6000 ' msl ctlr issu A tfc advisori . thi advisori indic that tfc wa '1 o'clock ; 3 MI ; ebnd ; alt unknown . ' about 20 sec after advisori acft IN question wa spot BY all 3 cockpit crew member . A singl eng ; sma Y wa seen btwn cloud ; AT 1 o'clock po . ( cloud cover 5/8 coverag cumulu -- vi below 15 MI . ) IT appear TO BE AT same alt ON A direct cours acft . IT wa estim that there wa NO vert sep about 500-700 ' horiz sep . acft then pass TO right OF MY acft what appear TO BE littl OR NO evas action . MY acft took NO evas action . total time btwn first visual contact until contact wa lost IS estim TO BE 5-10 sec . wdb X land w/o further incid . A phone call TO atc supvr wa made upon lndg . HE reveal that A sy error been made BY lcl ctlr . 
22,1,15500,standard separ between corp jet wdb acr . oper error . corp X wa ON AN ifr flt plan sfm TO eht . AT 16000 over mht ; acr Y wa sight BY plt OF X. corp X wa ON A hdg OF 280 deg . acr Y 'S hdg wa 330 deg . acr Y wa clbing through assign alt OF 16000 . center ctlr did not give US acr AS tfc nor did HE give acr US AS tfc . I estim that acr Y wa 500 ' below US 1 MI horiz US . I call center TO tell them ; 'corp X ha acr Y IN sight ; ' AS WE cross IN front OF acr ; acr plt call center ask ; 'who IS tfc xing IN front OF US ? ' center repli ; 'corp X ha you IN sight . ' IN MY opinion ; center ctlr did not give US proper ifr sep. ctlr did not give either one OF US AS tfc ; nor did HE tell either one OF US TO maintain visual sep. 1 ) thi prob wa discov BY plt OF corp X BY visual contact . 2 ) NO evas action wa taken . 3 ) both acft ON ifr flt plan . 4 ) situat occur becaus OF human error . 5 ) I have NO suggest AS TO how TO prevent thi happen again . note . I would not classifi thi AS A near miss ; becaus NO evas action wa taken . IN MY opinion ; IT wa AN incid . supplement info acn 94170 . preoccupi issu vfr tfc other function AT A sector where radar associ function IS NO longer staf ; I fail TO observ that 2 abov acft A factor each other . some prob overlap OF block . attempt wa made TO issu alt sep lat sep ; but acr Y did not respond . MY onli suggest IS that AT A low alt IN particular ; radar associ po should BE staf . 
23,14,5000,standard separ when sma climb through alt OF smt later separ not maintain . I wa work erick po AT NY tracon accept A hdof ON acft sma X clbing out OF 5000-6000 ' when I notic A tag AT 5000 ' move ebnd IN front OF sma X. I call tfc plt rpted HE did not see other acft . I then ask sma X TO increas hi rate OF clb TO get abov other acft . sma X wa ON A random rte when HE wa suppos TO BE ON v16 . callback convers rptr reveal : rptr took hdof ON sma X when acft wa some distanc outsid hi airspac boundari head toward hi airspac . transfer ctlr fail TO assur sep btwn sma smt Y befor HE transfer sma TO rptr 'S freq . sma X wa clbing TO 6000 ' but did not reach that alt befor lat sep wa lost smt Y AT 5000 ' . rptr wa exoner OF ani blame IN thi sy error . 
24,15,4000,close prox acr lgt-ga sma northeast OF pvd . ON apch TO pvd arpt ; ON radar vector quonset apch TO il 23l . hdg wa 050 deg assign WE dsnding 4000 ' TO 2500 ' . WE could see gnd straight down ; but forward visibl wa poor ; 2 MI . I wa tune il freq when capt notic AN acft IN R window . thi acft 'S hdg wa approx 330 deg IN A sharp L bank clbing . IT wa too late ani evas action acft miss US BY 200 ' . 
25,3,2500,close prox between acr ga-sma . unauth penetr OF airspac ( tca ) BY ga. plt deviat . depart rwi 9 AT bo ; sbnd about 3 MI off end OF rwi AT 2500 ' ; WE pass behind him . ctlr never call tfc . I notifi him OF conflict . A few min later HE told ME acft call IN ON anoth freq . thi IS AN appar violat OF tca . offend acft must have seen ME AS I all MY light ON ; AS I alway DO tkof lndg . callback convers rptr reveal : rptr say that HE later review incid atc supvr learn that sma wa IN tca w/o atc clrnc . sma plt turn ON transpond call apch ctl after incid . rptr IS pic major airlin think that fli IS get more hazard ; AT least IN area where HE fli . HE submit mani asr rpt becaus IT seem like someth bad happen ON almost everi trip . say na atc sy IS overload . 
