,Place.3,Place.5,Report
156,3,2500,nmac . ON sep/sat/91 AT xa05 a.m. ; I wa fli vfr AT 2500 msl ( approx 2000 FT agl ) great beminton ( gbr ) TO fisher island ; NY ( 0b8 ) . nav wa loran direct I just pass about 3 MI NE OF hartford vortac ( hfd ) . I wa ON flt bradley apch ( bdl ) freq 125.8 squawk 5250 . bradley apch wa fairli busi but alert ME TO other tfc . bradley apch just ask ME TO chang TO A new sector freq ( I believ IT wa 111.05 ) . MY hdg wa about 150 deg . I wa just about TO dial IN new freq when I notic A white twin ( smt class ) NO more 1/3-1/2 MI away come straight AT ME A hdg OF about 270 deg AT MY exact alt . I took immedi evas action turn sharpli TO R. plane pass approx 150 FT behind ME take NO evas action . I could not get N number . I call bradley ON current freq ( 125.8 ) ask IF they seen anyth . ctlr said 'no ' . I then switch over TO new sector ask IF they seen anyth . again ; 'no ' . I CA n't believ IT ! that wa A larg target well within radar coverag -- AT least A primari echo should have been visibl even IF plt did not have transpond ON . I think ctlr did not want TO admit their failur TO notic A nmac . they call NO tfc AT time . lesson : 1 ) alway keep your eye open ; even ON flt . 2 ) especi watch AT sector corner . 3 ) some plt may BE fli illeg transpond off . 4 ) I AM file A complaint against ctlr . 
157,5,3000,plt OF sma depart norwood ; MA ; allegedli enter base OF bo tca caus tfc conflict . given R downwind dep rwi 35 ( norwood ; MA ) . wa close IN TO avoid 2000 FT floor OF boston tca . thought MY clb wa below 3000 FT floor OF boston tca . call BY cape apch TO call boston twr . wa told that I violat tca floor wa within A MI OF acft ON il 24 apch TO boston . other acft saw avoid ME . I never saw IT . I CA n't argu radar but I believ I wa below floor . clred norwood twr freq sinc I wa below tca I wa not ON boston apch/dep freq . I wa await recept OF cape apch/dep freq . previou WK I tri TO contact boston apch/dep clbing norwood but wa unabl TO get ON TO freq ; SO thi time I did n't tri . I wa squawk 1200 ON mode C. next time I 'll tri TO talk TO boston again . 
158,3,3750,corp acft ha nmac sma ON sequenc TO apch . NO TA given OF sma . MY acft wa be vector sequenc into downwind leg rwi 20 AT hvn . NY apch ctl clred MY acft TO maintain 4000 FT ON A hdg OF 360 deg ( ? ) sequenc behind AN acr mlg which wa W OF arpt ( AT 3000 FT ) . both crew look visual sight TO mlg which should have been IN 9-11 o'clock po . I made A visual scan TO MY R wa surpris TO see AN sma AT MY 2 o'clock po approx 1/4 MI away ON AN appar collis cours . hi cours wa approx due W. sma wa exactli AT MY alt OF 4000 FT . I call tfc TO MY coplt said someth TO effect that sma could BE A problem . after approx 2 second OF observ OF sma I determin that there wa NO rel movement OF sma IN windscreen that 2 acft ON A collis cours . I told MY coplt TO tell apch ctl WE take evas action ; I initi A rapid dscnt TO pass below sma . appar xmission TO apch ctl wa block momentarili BY other radio tfc . dure next break IN chatter ; ctlr call US told US TO maintain 4000 FT ; possibl she seen target deviat assign alt . WE then inform her that WE taken evas action TO avoid A midair collis . she inform US that she not observ ani other tfc comment that unknown acft wa probabl not transpond equip . acft went momentarili TO 3750 FT msl 10 second sma pass overhead slightli aft . WE then clbed back TO assign alt . there wa NO conflict mlg . 
159,6,2400,acr lgt alt dev ON apch into bo IN respons TO tcasii RA . plt fli thi acft respond TO A tcasii 'clb ; clb ' RA . acft clbed 500 FT abov glide path befor RA announc 'clr OF tfc ' . boston logan twr wa notifi OF dev . acft wa abl TO return TO glide path A normal lndg . A commut acft wa ON AN apch TO rwi 4L ; 3 1/2 MI ahead OF thi acft . IT wa ident ON radar screen wa not respons RA . logan twr advis thi crew that NO acft IN their vicin AT time OF RA crew saw NO other tfc . IT wa specul that perhap tcasii sy wa respond TO ship tfc IN boston harbor . 
160,16,2000,acr X ltss smt Y. sy error . tcasii TA RA . I wa involv IN AN operror ON nov/wed/91 . AT time error occur MY attn wa divert TO A lost acft that I wa tri TO vector TO AN arpt IN MY airspac . acr X wa given A dscnt TO 2000 A vector OF 070 deg told TO rpt arpt IN sight . smt Y wa be vector TO A second practic apch ; I assum thi acft wa vfr ON practic apch ; want AN ifr clrnc TO islip arpt after HE finish . I A third acft ON apch TO anoth arpt ; which took more OF MY attn . I wa again divert TO lost acft . acr X advis ME that HE AN acft AT hi 10 o'clock po 4 MI ; I then issu A 180 deg hdg . HE advis that tcasii wa tell him TO clb ; I roger hi xmission . I soon after clred acr X AN il apch . I later wa reliev inform MY supvr OF incid . callback convers rptr reveal info : rptr state supvr wa AT po TO provid assist lost acft . conflict alert activ btwn acr X smt Y . when rptr turn acr X separ reduc TO 1.6 MI 200 ft. acr X A tcasii RA clbed 300 FT . rptr said HE should have known smt Y wa ifr becaus tag did not have A V indic acft wa vfr . 
161,4,1400,nmac AT ltt fli through unctl field airspac NO com . AN ltt wa fli opposit direct . IT cancel advisori sever min prior . IT then flew over bar harbor arpt without talk ON unicom . thi arpt IS veri busi dure summer fall month . AN sma A ON final TO rwi 4 tri TO reach ltt ON unicom . IF IT n't been thi call ; I would not have known ltt wa IN area . base ON call sma A TO thi ltt I start A dscnt . ltt transit area AT 1500-2000 agl without even talk ON unicom . AT time they 3 sma ; A glider ; AN ltt B all within 5 MI OF arpt . I would like TO see A publish recommend flt around bar harbor/arcadia natl park . AT time I wa complet A scenic flt around island 3 pax . I ON both rotat beacon strobe lndg light . past 50 yr peopl have been fli around island IN A clockwis manner thi ha becom accept practic IN area . both ltt AN sma C flew around island IN A counter clockwis manner that day . I met sma C ON opposit side OF island earlier IN day ( 100 FT vert 300 horiz ) . near miss . sma C wa monitor unicom AT time I inform him OF accept practic OF fli clockwis around island AT that time . IN thi type OF fli all acft tend TO seek lowest alt that IS smooth their sightse activ . thi put opposit direct acft IN direct conflict around edg OF arcadia natl park . ON thi day that alt wa 1400 FT msl . everi year past 5 yr I have AT least 2 such incid dure summer fall season . 
162,15,6700,acr ha tcasii RA ON dscnt ; clb . dure dscnt TO bdl IN ceil visibl unlimit ; tcasii wa ON IN ra/ta mode . pass 9000 ft. atc advis tfc AT 11 o'clock ; 7 MI ; nbound AT 6400 FT ; unconfirm . next call atc : tfc 10:30 ; 3 MI ; ebound . I extend wingtip lndg light continu visual scan . I also disengag autoplt TO enabl evas action IF warrant . next : tcasii annunci tfc AT 10:30 -1100 FT . still unabl TO find tfc . anoth atc advis OF tfc AS WE pass through 7000 FT . I assum WE clred tfc ( tfc behind US ) . AS WE NO contact/visu sight conflict acft wa close TO alt IN clr . AS WE continu through 6700 FT A tcasii resolut wa trigger . tcasii advis ; 'clb ; clb ' indic 1500 fpm clb which wa immedi . AS WE reach 7000 FT level off wa indic . flt continu unev TO bdl . conclus analysi : I believ that bdl tracon misjudg vert horiz flt path . hi expect wa that WE would have pass overhead tfc which wa AT AN unconfirm alt . HE reli ON thi TO achiev separ . NO vector given TO assur horiz separ . I reli ON visual sight tfc WX wa SO good . AS A result I did not request A hdg TO assur separ . I reli ON bdl TO provid horiz separ IN event visual sight wa not achiev . MY normal dscnt profil IS 240 kt ias/2200-2500 fpm . dure discuss OF event bdl tracon ctlr state gnd spd wa 270 kt . I can onli assum that acft wa trim slightli nose down AS I becam intent ON tfc I allow spd TO build UP ( although I can hardli believ 270 kt ) . I may have push nose down IN AN attempt TO increas visual scan area . thi would have creat A rapid dscnt which elimin requir vert separ . conclus : IN futur I will allow OR accept onli horiz separ vfr/ifr tfc AT unconfirm alt . IF not offer ; I will request separ . info ctlr ha ON tracon display ; HE wa IN A po TO have offer A posit resolut well befor situat becam critic . I would recommend AN earlier initi ON part OF ctlr . 
163,70,12000,flc OF lgt ON dscnt pass commut 500 FT . talk bo center ON freq 124.85 ; center rpted AN sma AT 11 o'clock po AT 12500 FT . they told US WE could level off AT 13000 FT IF WE want until WE saw vfr tfc . WE clred TO 12000 . I saw AN acft AS WE pass 12700 FT but IT wa NO sma . I call center TO reconfirm alt type OF acft AS WE pass 500 FT under AN ltt . I ask ltt alt HE rpted 12500 FT . I queri center . center said WE could have level AT 13000 ft. NO evas action taken ; but too close comfort . 
164,15,15000,acr X ltss cpr Y. sy error . I wa train A person IN radar po AT bosox sector IN area C IN boston center . WE A full perform radar associ IN d-side . 30 min prior TO incid ; tfc wa moder which radar traine wa handl satisfactorili . ( 8-15 acft ) . acr X bo dep AT 160 direct baf AN overflt TO lga . cpr Y wa A pvd dep ( request fl390 ) which WE clbed TO 110 turn 20 deg L tfc AT 120 . onc WE clred 120 tfc WE clbed TO 150 . tfc built IN hfd vicin which radar traine wa satisfactorili handl . radar associ then receiv A call ctr sector ON A point out ON AN acr orh dep clbing TO 160 direct ctr . radar associ approv point out . I turn TO radar associ said call them back tell them unabl due TO tfc IN vicin also TO make sure ctr sector A point out ON cpr Y AT 150 ; get ctl ref acr X other acr . radar associ complet call said 'it 'S all set ; ctr IS watch cpr Y . ' radar traine then turn cpr Y 30 deg R TO initi clb onc acr X AT 160 wa clr . next updat acr X block show 160 dsnding TO 140 . I told radar associ TO find out what ctr wa do ref cpr Y which WE turn 30 deg R. ctr told radar associ they expedit acr Y TO 140 . onc they clr WE clbed cpr Y TO 230 . separ been lost when ctr dsnded acr X TO 140 cpr Y IN close prox AT 150 . IT wa MY understand ( also radar traine 'S ) that all coord wa complet BY radar associ that ctr knew what WE do cpr Y ref acr Y could have been prevent better com coord btwn sector involv btwn radar associ radar po . 
165,6,1900,sma ON inst apch ha sma appear under R wing . nmac . AT approx xa45z ; ON AN ifr clrnc ; have been clred TO W field vor rwi 20 apch AT 2100 msl 1 NM outsid klyde intxn ; AN sma A appear under R wing OF MY acft . I inform bradley ctlr ; execut A 360 sharp R turn separ ; took MY student off hood ; cancel MY ifr clrnc contact W field twr . upon complet turn I note that sma A wa directli ahead AT MY alt 1900 FT . I then sma A make A straight-in apch TO rwi 20 W field . when clring rwi I note sma A ; white red mark ; number xyy . callback convers rptr reveal info : rptr state HE call apch after lndg got NO satisfact regard situat . inform other plt wa vfr rptr acft IN sight . IF true prox wa much too close rptr . extrem startl NO warn . ctlr state HE A traine AT time did not want TO take over too soon . thi immedi led rptr TO question just how close DO WE have TO get ? rptr ha friend IN faa who suggest HE file asr rpt . 
166,1,1440,sma ON downwind AT unctl field ha nmac sma downwind opposit direct . do touch-and-go IN MY sma A ; I wa midway downwind rwi 5 AT pattern alt when AN acft came directli toward ME AT same alt do A R upwind rwi 23 . unknown acft did A dive turn TO L pass under away ME TO MY R -- distanc wa approx 100 FT . I note last 2 number type AS sma B . after lndg taxi off rwi 5 ; thi unknown acft land behind ME I wa abl TO note full tall number . after ty down MY acft I went into fbo offic AT N central relat incid TO personnel . AN acquaint IN offic ask IF I got tail number ? repli xxxi ; HE said 'oh ; that 'S other fbo 'S plane ! ' 'mr . X seat over there ha been talk TO that plane all along ON portabl com radio . ' intent unknown thi acft -- AT time OF entri into upwind lndg rwi 23 . acft did not seem TO BE ON N central unicom . 
167,10,4000,instructor spi practic maneuv ha nmac smt . dure A normal aerobat train flt after complet A 180 deg clring turn I thought I saw someth over MY R shoulder . I look around did not see anyth . I brief MY student ON how TO DO A dep stall after slow down TO dep spd WE ad pwr start TO pull UP . WE start AT 4000 FT AS WE pass through 4300 I spot A twin eng plane come over MY L shoulder approx 300 FT higher . I pull pwr lower nose watch plane continu ON . 
168,15,14000,flc OF ltt tcasii RA . clbed 500 FT TO clr RA . atc advis that compani ltt US IN sight would BE pass under US . I acft ON tcasii but could not see acft visual . I then receiv A tcasii TA BY A RA TO clb . WE depart assign alt TO RA . I visual contact compani acft AS IT pass under US . I estim 500 ft. tcasii show IT AT 13600 assign alt wa 14000 . RA clbed US TO 14500 . NO atc separ wa lost AS rpted BY atc . 
169,23,8000,gov ltt get IN prox TO other tfc IN vfr dscnt proc IN prox OF cloud . ON afternoon OF 1/mon/92 ; I wa act AS coplt ON A turbo ltt be use IN R D. IT wa vfr WE dsnding out OF 10500 FT msl hdg sw. WE dsnded btwn some broken cloud around 8500 FT msl . onc below cloud WE start TO turn ( R ) nwesterli . I look TO R TO clr area saw AN airplan . AT 4 o'clock po AT about 3/4 MI move IN approx same direct . I suggest pic delay further turn until WE through other plane 'S alt which wa onli A few second . NO other action wa taken OR need . apch ctlr US TO lndg arpt ( bed ) ask gnd ctl TO have US call him . pic call ctlr BY telephon TO explain event list abov . appar other acft complain about prox . NO other action wa taken BY ctlr except TO suggest WE get radar advisori IN futur . 
170,18,5700,flt instr spi ha close encount jet . take evas action . cruis IN contact under ctl OF boston apch I saw A larg airlin jet AT 10 o'clock po ; converg path ; within 1 MI . HE seem TO BE AT MY alt . atc did not rpt tfc TO ME ; nor did I hear MY po rpted TO hvi . after attempt TO determin hi alt ; I decid I could delay NO longer . I knew that IF I took evas action now ; I would definit BE abl TO clr tfc . I took ctl PF ; turn 45 deg TO MY R dsnded quickli TO approx 5700 FT when I saw jet behind ME well abov . I then return TO 6500 FT ON cours befor I could inform atc OF MY evas action I wa queri BY atc . atc then told ME jet wa level AT 6000 that MY evas action brought ME closer TO hi alt . problem wa discov BY adher TO see avoid concept . contribut factor : atc 'S failur TO inform ME OF converg path tfc . even though there wa 500 FT vert separ IT wa difficult TO confirm jet wa below ME ; not clbing . human perform consider : percept : 500 FT separ IS difficult TO determin confid necessari TO ensur collis avoid . judgement : I judg jet TO BE either AT MY alt ; OR clbing sinc IT just depart boston ( OR IT appear TO BE depart boston ) . decis : I NO time TO further attempt TO determin alt converg nor TO queri atc about airlin . SO I decid TO take action that should ensur avoid ; rather gambl that jet wa lower ME . actions/inact : IF I wa inform BY atc AS TO jet 'S alt ; I would have been more confid about separ ; mayb evas action would not have been necessari . lack OF A TA IN such A tight situat led ME TO believ that mayb someth wa awri atc . 
171,20,11250,flc clb into AN nmac known vfr tfc . FO wa fli leg . WE clred TO 17000 . WE contact boston ctr HE advis US TO level AT 10000 call vfr tfc hdg ebound AT 1:30 po 11500 ft. WE call that tfc IN sight clred TO 'ref that tfc clb TO 17000 . ' I watch tfc notifi capt that IT wa 'constant bear ; decreas rang . ' HE acknowledg that told FO TO increas rate OF clb . FO increas rate OF clb . about 10 second later tfc appear much closer IT did when WE first sight IT . WE AT 10900 FT capt instruct FO TO push IT over . FO perform A mild push over . clb rate decreas approx 2000-1000 fpm . acft continu TO clb capt shout 'level off ' push forward ON ctl column . WE level AT 11250 just AS commut plane pass directli overhead . what caus problem . WE saw acft assum that IT wa suffici far away due TO it rel size IN windscreen . IT wa actual much closer WE thought becaus IT wa A twin eng commut plane . capt did not take adequ action TO com TO FO hi desir him TO level acft AT 11000 FT . thi wa way too close . IT definit would have been A mid collis . WE must have look huge TO that commut . 
172,10,6000,apch ctlr unauthor uncoord penetr OF airspac atx Y ltss atx X. sy error . work vikki radar I took A hdof 490 ON atx X AT 60 ON V1 NE OF mad . shortli after plt chked IN ; I saw atx Y also AT 60 ; NE OF atx X hdg ON A track that would merg atx X ; slightli faster . I issu tfc TO atx X who advis HE wa imc . I chked TO see IF love ctlr wa work atx Y ( HE taken hdof ) ; but wa told HE wa not . I then call y90 TO see IF they still work atx Y TO determin IF they turn him wbound ( away atx X . ) y90 advis atx Y wa turn wbound I IN turn advis them I wa turn atx X sbound - which they approv . I then turn atx X ON A hdg OF 180 ; away tfc . 
173,20,13000,acr X dscnt through occupi alt IN apch ctl airspac conflict alert activ acr Y . acr X ON swf arr IS rted via bdr v91 stubi v205 tresa swf . these acft have TO BE dsnded into n90 'S airspac IN order TO meet A xing restrict AT 60 anoth n90 sector . but first n90 sector ( liberti E ) will not work acft but will accept pointout ON acft dsnding UP TO 1000 FT into their airspac . WE get acft zni AT lowest visibl FL ( fl190 IN thi instanc ) . liberti E approv A pointout ON acr X dsnd TO 140 onli . they then call back issu tfc acr X which wa directli IN front OF acr X clbing TO 17000 . WE agre TO turn tfc TO NW dsnd acr X underneath their tfc which they stop AT 160 . I stop acr X AT 17000 turn TO A 310 deg hdg . when I achiev later separ ; issu A dscnt TO acr X TO 14000 . liberti E then call US said WE could GO TO 12000 acr X. I issu dscnt TO 120 ON acr X shortli thereaft ; observ A conflict alert acr Y who show AN alt OF v128 IN block . I assum acr Y wa vfr that acr X would BE safe IN front OF tfc befor their alt close . WE then found out acr Y wa ifr even though comput NO flt plan . I could not stop dscnt OF acr X IN time separ wa lost ( 3.6 NM ) . sinc both acft IN n90 'S airspac ; I wa told that NO operror exist sinc they onli need 3 NM separ . but n90 NO idea what hdg I issu acr X ; AS I onli told them that I would GO NW ( which wa toward acr Y ) TO GO under tfc they issu TO US ON pointout . IN MY opinion ; IT wa onli blind luck that prevent acr X come within 3 NM OF acr Y whole practic OF n90 not work thi tfc IS AN unsaf proc . thi sector specif thi proc wa ucr' over 6 month ago . SO far ; noth ha chang thi exampl illustr how unsaf IT IS . WE ; ctlr OF area E ; howev ; who are stuck work thi proc ; make IT work becaus WE have TO . zni n90 have all but refus TO even discuss ani plausibl solut . IT IS veri frustrat AS n90 refus TO work clbing dsnding tfc IN their sector ; even though their separ minima IS smaller . WE work same airspac more tfc they DO now . hope ; thi letter will lead TO improv proc IN thi sector workability/flexibility/relationship n90 . IN MY opinion ; A midair collis will result IN thi sector IF current proc are not chang . 
174,10,4500,privat plt OF sma acft encount A nmac A glider IN unctl airspac IN vfr condit . fli under vfr AT cruis level 4500 FT msl over vicin OF fitchburg ; MA arpt ( fit - unctl ) ; I suddenli encount A glider AT MY 11:30 o'clock ; approx . 100 FT below ahead . I wa continu scan other tfc landmark ( use pilotag dead reckon ) enrt nashua ; NH ; arpt ( ash ) direct TO worcest ; MA ; arpt ( orh ) ; via A flyover OF fit arpt . glider appar wa ride A convect current below MY flt path ascend quickli . I wa unabl TO see IT until IT almost reach MY alt AS it po below wa block BY MY cowl ctl panel . when IT 'pop ' into view just abov slightli TO L OF MY cowl ; IT wa approx 100 FT ahead below MY path . glider plt may have seen ME also AT that point AS IT seem that HE began TO arrest hi rate OF ascent . sinc HE wa IN A rise path that I judg would take him rightward across MY front ; I did not execut A rightward evas movement ; but instead immedi gave full throttl TO clb over what I judg hi 'back ' path TO BE . A collis wa avoid . contribut factors/addit info : MY rte ash TO fit wa intend TO avoid onli arpt near MY rte that ha publish ( NY section ) glider activ . yet ; encount occur approx 10 MI that arpt ( pepperel sport center ) over fit arpt where NO glider activ IS indic ON section . other plt IN area inform ME after thi incid that someon wa fli A glider out OF fit arpt ON same wkend AS encount . I mention thi onli AS coincident ; sinc I DO not know IF glider AT fit wa same one that wa encount . there wa NO notam OR other notic OF glider activ IN that vicin . perhap NY section should indic glider activ IN that vicin . 
175,6,3500,acr ON initi clb IS vector toward circl vfr tfc . receiv tcasii TA ; then RA . respond clb which precipit RA tfc abov . WE depart rwi 22r AT bo AT xx46 lcl . dep instruct AN initi clb TO 3000 FT A R turn after tkof TO 300 deg . after contact dep ctl ; WE clred TO 4000 FT ON same hdg . atc then issu A TA vfr tfc AT 11 o'clock 2-3 MI AT 3500 FT circl . AT almost same instant WE got A tcasii TA immedi BY 'monitor vert spd ' BY A tcasii RA -- clb . atc AT same time wa give US A R turn TO 360 deg ; maintain 4000 FT ; direct manchest mht when abl . I did not have tfc IN sight tcasii clb RA . result OF tcasii clb creat anoth TA apch 5000 FT tfc . atc determin that 5000 FT tfc visual contact US therefor HE continu clb TO 5000 FT then A further clb TO 12000 FT . initi conflict wa caus BY 3500 FT vfr tfc circl below US ; AS per attach diagram ; AS WE clbing TO 4000 FT . RA caus ME TO clb through 4000 FT creat A potenti conflict 5000 FT tfc . sinc thi IS second situat I have encount like thi IN last 4 month ; I AM perhap IN A po TO suggest that atc BE given some train ON work OF tcasii . vector AN acft A chang vert veloc TO within 500 FT OF anoth acft will caus AN RA . 
176,5,9000,capt OF mdt acr acft respond TO tcasii RA clbed abov assign alt clred tfc BY approx 100 FT result IN A nmac . WE just cross bdr vor intercept 054 deg radial v229 . tcasii issu TA ( intrud ) AT 1:30 -300 . moment later atc call tfc AS unconfirm vfr . WE did not see him . then tcasii issu RA ( threat ) 'clb . ' I disconnect autoplt clbed AT indic rate 9000 TO 9300 AT which point tcasii announc 'clr OF conflict . ' FO sight threat acft AS IT pass directli beneath US . dure clb WE advis atc OF RA respons TO IT . atc wa unawar that WE tcasii equip AS compani not file flt plan TO indic such . HE not been prepar A tcasii event . HE then point out that WE 2 MI E OF v229 which seem unnecessari AS WE just cross vor IN process OF intercept cours . 
177,0,14500,acr X tcasii TA RA stop dscnt conflict vfr acr Y . see avoid concept . apch gdm ON gardner 2 arr bo ctr point out vfr tfc AT approx 12 o'clock . clrnc wa TO cross bronc AT 11000 . bo mention that tfc wa wbound would level AT 14500 . WE thought ctlr would plan dscnt below 14500 befor pass point . bo ctr never stop dscnt nor did they stop other acft 'S clb . WE realiz A potenti problem first time when tcasii issu AN RA . tcasii said 'reduc your dscnt ' SO I did . I reduc dscnt TO 0 fpm AS WE level AT 14300 that IS when acft pass abeam ON port side . WE tfc IN sight dure entir episod ; but found IT difficult TO judg just where HE wa IN relat TO po . after pass ; WE question bo AS TO hi po alt . respons wa defens ctlr state that HE told US WE could level AT 15000 until tfc pass IF WE wish TO ! NO one IN MY crew heard that xmission . thi incid could have been prevent IN mani differ way . vfr tfc should not have been allow TO fli against gardener-2 arr tfc clbing through dscnt alt . avoid turn could have been issu ; alt chang could have been appli . more better com could have been use TO make each OF US more fulli awar OF situat . ctlr must have watch 2 OF US come togeth ON hi radar screen AT same alt ; HE must have been abl TO see scenario develop -- yet ; HE sat there watch all thi develop said noth ! supplement info acn 209780 : AT 16000 FT 5 MI W OF gardner ; capt pull out spdbrake TO increas rate OF dscnt IN order TO make xing restrict . AT some point ; I heard ctlr say someth about '15000 ; ' but did not catch whole xmission assum that HE wa tell US that tfc wa AT 15000 ft. FO did not acknowledg that call . I thought that vfr tfc might BE get close TO US SO I kept MY eye ON him . AT approx 15000 FT tcasii gave US A verbal RA OF 'reduc dscnt ; reduc dscnt . ' thi certainli caught MY attn SO I glanc AT tcasii inst which show A red arc ON lower half OF case . I did not focu MY eye ON inst becaus I want TO clr tfc . capt start TO stop dscnt AT thi point . AT approx 14500 FT I saw tfc pass off L wing within 1/4 MI what appear TO BE same alt . be that IT wa night ; I can onli guess AT horiz distanc . capt not made ani evas turn ; I notic that alt bottom out AT 14300 FT AS WE pass over gardner vor . ctlr never issu US ani turn OR alt chang . vfr tfc did not say anyth about conflict . A few MI later ; FO told ctr that WE seen tfc pass US ask what alt HE wa AT . ctlr said HE wa AT 14500 ft. AT thi point ; vfr tfc said HE though WE told that 'it wa suggest that WE maintain 15000 ft. ' ctlr said noth . MY airplan 'S crew member never heard 'suggest ' certainli did not acknowledg ani such xmission AT time . IN MY mind ; throughout thi whole situat ; I thought that vfr tfc wa maintain 15000 FT that WE would BE dsnding well IN front OF him . I feel that atc ctlr 'S lack OF aggress ; failur TO ctl hi airspac ; overal nonchal wa caus OF tfc conflict . IT IS beyond belief that bo ctr would allow A vfr airplan TO fli outbound ON arr rte TO bo . 
